Question Link, Question,Answer Count,Upvotes,Count
'/questions/70933431/how-to-find-pine-editor-coin-name-and-parity',how to find pine editor coin name and parity?,0,0,1
'/questions/70933428/hamcrest-set-issuperset-failing-the-assertion',hamcrest: set_issuperset failing the assertion,0,0,1
'/questions/70933427/tkhtmlview-htmllabel-change-font-size',tkhtmlview HTMLLabel change font size?,0,0,1
'/questions/70933424/combining-multiple-filters-with-ilike',Combining multiple filters with %ilike%,2,0,1
'/questions/70933421/typescript-interface-being-string-or-object',typescript interface being string or object,0,0,1
'/questions/70933420/angualr-routing-with-msal-azure-ad-integration',Angualr routing with Msal Azure AD integration,0,0,1
'/questions/70933419/redux-toolkit-save-dark-mode-value-to-local-storage',Redux Toolkit - Save dark mode value to local storage,1,0,1
'/questions/70933418/python-round-doesnt-round-correctly',Python round() doesn't round correctly [duplicate],0,0,1
'/questions/70933417/how-to-display-only-the-overwritten-files-while-unzipping-a-zip-file',How to display only the overwritten files while unzipping a .zip file?,1,1,1
'/questions/70933413/hello-there-can-pls-someone-explain-me-how-exactly-i-can-make-a-solution-to-get',Hello there  can pls someone explain me how exactly I can make a solution to get the full "Hello World" encrypted into the morse code?,6,-1,1
'/questions/70933412/calculating-the-stack-usage-in-rtos-application',Calculating the Stack usage in RTOS application,0,0,1
'/questions/70933411/what-does-this-mean-for-viewpagers',What does "this" mean for ViewPagers?,1,-1,1
'/questions/70933410/wxwidgets-3-1-5-msw-hidpi-scaling-problems-causing-controls-to-have-the-incorr',wxWidgets 3.1.5 MSW - HiDPI scaling problems causing controls to have the incorrect size,0,0,1
'/questions/70933405/how-to-create-a-hierarchy-in-laravel-with-optional-cutoffs',How to Create a Hierarchy in Laravel with Optional Cutoffs,0,2,1
'/questions/70933404/how-can-i-reach-values-of-a-key-pair-value-within-a-value-with-list-comprehensio',How can I reach values of a key pair value within a value with list comprehensions?,1,-1,1
'/questions/70933400/how-can-i-launch-the-registration-page-using-auth0-auth0-react',How can I launch the registration page using @auth0/auth0-react?,1,0,1
'/questions/70933398/add-href-in-onclick-attribute-in-html-form',Add href in OnClick attribute in html form,2,0,1
'/questions/70933397/get-request-by-qwebenginehttprequest-pyqt5',GET request by QWebEngineHttpRequest (PyQt5),0,0,1
'/questions/70933396/how-to-get-applocalizations-import-suggestion-in-android-studio-quick-fix-menu',How to get AppLocalizations import suggestion in Android Studio Quick Fix menu,1,0,1
'/questions/70933395/retrieving-custom-user-roles-after-login-blazor-wasm',Retrieving custom user roles after login - Blazor WASM,0,0,1
'/questions/70933394/deploying-a-sveltekit-app-on-a-vps-with-apache2',Deploying a SvelteKit app on a VPS with apache2,0,0,1
'/questions/70933393/how-to-make-modifications-in-mnist-dataset-images-stored-in-idx3-ubyte-and-save',How to make modifications in MNIST dataset images stored in idx3-ubyte and save them back in idx3-ubyte format,0,0,1
'/questions/70933392/streamlit-share-cloud-can-not-find-pandas-reader',Streamlit Share cloud can not find pandas_reader,1,0,1
'/questions/70933390/android-how-to-get-rid-of-the-very-top-bar',android - How to get rid of the very top bar,1,0,1
'/questions/70933389/kentico-adding-an-anchor-tag-in-a-repeater-transformation',Kentico - Adding an anchor tag in a repeater transformation,0,0,1
'/questions/70933388/dataframe-if-a-condition-is-met-on-a-dataframe-column-then-get-this-row-and-the',Dataframe if a condition is met on a dataframe column then get this row and the next 3 rows in a dataframe?,1,-1,1
'/questions/70933386/could-not-connect-to-sharepoint-online',Could not connect to SharePoint Online,1,0,1
'/questions/70933384/pybind11-return-a-shared-ptr-of-stdvector',pybind11 - Return a shared_ptr of std::vector,1,1,1
'/questions/70933383/python-subprocess-for-windows-executable-works-from-powershell-but-does-not-work',Python Subprocess for Windows Executable works from Powershell but does not work from Windows Code Server Terminal (using WSL Ubuntu),0,0,1
'/questions/70933380/how-to-dynamically-create-pyspark-code-from-config-file-or-array',How to dynamically create pyspark code from config file or array?,0,0,1
'/questions/70933375/sql-how-to-inner-join-based-on-a-condition',SQL how to inner join based on a condition,3,-2,1
'/questions/70933374/react-router-6-will-you-use-modal-in-the-way-under-offical-example-section',react-router-6 will you use modal in the way under offical example section?,0,0,1
'/questions/70933370/ssl-mailcow-not-connecting',SSL Mailcow Not Connecting,0,0,1
'/questions/70933366/res-render-doesnt-add-parameter-to-url',res.render() doesn't add parameter to URL,0,0,1
'/questions/70933363/macos-how-to-prevent-that-showing-an-alert-dismisses-the-popover-it-comes-from',macOS: How to prevent that showing an alert dismisses the Popover it comes from,0,0,1
'/questions/70933362/how-can-one-add-internal-certificates-to-a-docker-file',How can one add internal certificates to a docker file?,0,0,1
'/questions/70933357/populating-a-subdocument-schema-attached-to-a-user-model-using-graphql-mongoose',Populating a subdocument schema attached to a User model using GraphQL  mongoose,0,0,1
'/questions/70933354/how-to-get-power-spectrum-frequency-vs-intensity-for-a-sound-signal-in-wav-fo',How to get power spectrum (frequency vs intensity) for a sound signal in .wav format,0,0,1
'/questions/70933351/access-forbidden-when-trying-to-create-segment-from-an-existing-list-sendgrid-v',Access forbidden when trying to create segment from an existing list (Sendgrid v3 API C#),1,0,1
'/questions/70933350/how-to-change-a-picture-with-another-one-in-the-start-of-the-word-press-site-in',How to change a picture with another one in the start of the word press site in the Zephyr 3.1,0,0,1
'/questions/70933348/how-many-executors-is-my-foundry-job-using',How many executors is my Foundry job using?,1,1,1
'/questions/70933347/cardview-items-in-recyclerview-temporarily-duplicating-previous-entries-when-add',Cardview Items in Recyclerview temporarily duplicating previous entries when adding new data,0,0,1
'/questions/70933346/how-can-i-run-python-script-inside-a-frame-in-tkinter',How can I run python script inside a frame in tkinter?,1,0,1
'/questions/70933344/java-101-beginner-question-about-while-and-if-loops',Java 101: Beginner question about while and if loops [duplicate],0,-1,1
'/questions/70933341/how-do-i-exit-a-thread-when-my-timer-hits-0',How do I exit a thread when my timer hits 0?,0,0,1
'/questions/70933340/java-spring-boot-api-failing-to-initialize',Java Spring Boot API failing to initialize,1,0,1
'/questions/70933337/listed-on-microsoft-appsource',Listed on Microsoft AppSource,0,0,1
'/questions/70933336/cordova-ios-6-2-0-spash-screen-disappears-before-this-splashscreen-hide',Cordova iOS 6.2.0 Spash screen disappears before this.splashScreen.hide(),1,0,1
'/questions/70933334/create-a-combined-text-file-showing-the-date-modified-of-each-individual-text-fi',Create a combined text file showing the date modified of each individual text file,1,0,1
'/questions/70933333/using-flex-with-react',Using flex with React,1,0,1
'/questions/70933332/how-to-sum-the-values-of-a-ko-observable',How to sum the values of a ko observable,1,0,1
'/questions/70933331/can-turtle-print-blank-lines',Can turtle() print blank lines?,1,1,1
'/questions/70933328/how-can-i-get-the-corresponding-price-from-my-feed-based-on-my-product-name',How can I get the corresponding price from my feed based on my product name?,0,0,1
'/questions/70933327/net-6-failing-at-decompress-large-gzip-text',.NET 6 failing at Decompress large gzip text,0,2,1
'/questions/70933326/how-to-list-blobs-by-pages-in-google-cloud-through-golang',How to list blobs by pages in google cloud through golang?,0,0,1
'/questions/70933325/laravel-request-fullurlwithquery-doesnt-work-as-expected',Laravel request()->fullUrlWithQuery() doesn't work as expected,2,0,1
'/questions/70933319/how-do-i-make-one-patch-as-a-variable-with-pytorchs-unfold-method',How do I make one patch as a variable with pytorch's unfold method?,1,0,1
'/questions/70933315/pull-values-that-have-only-numbers-plsql',Pull values that have only numbers PLSQL,1,-1,1
'/questions/70933314/make-the-button-on-right-and-center-on-the-card-css',Make the button on right and center on the card css,3,-1,1
'/questions/70933313/android-folder-picker-intent-launches-file-picker',Android folder picker intent launches file picker,1,0,1
'/questions/70933311/how-do-i-find-in-dataframe-value-in-column-b-exists-in-column-a-in-a-dataframe',How do I find in dataframe value in column B exists in Column A in a dataframe  and if so, replace the value in column B with Column A's value?,1,1,2
'/questions/70933310/parallel-calls-in-kotlin-without-blocking-main-thread',parallel calls in kotlin without blocking main thread,1,1,2
'/questions/70933308/write-a-generic-method-that-can-handle-different-stored-procedure-calls',Write a Generic method that can handle different Stored procedure calls [closed],0,-1,2
'/questions/70933216/undefined-reference-not-appearing-disassembly-for-objdump',undefined reference not appearing disassembly for objdump,0,0,1
'/questions/70933215/why-are-my-nav-links-disappearing-as-the-viewport-shrinks',Why are my nav links disappearing as the viewport shrinks?,1,0,1
'/questions/70933214/css-pinch-to-zoom-with-css',CSS: pinch to zoom with CSS?,0,1,1
'/questions/70933212/hibernate-and-sqlite-set-unique-constraint-on-creation',Hibernate and SQLite : Set unique constraint on creation,0,0,1
'/questions/70933211/random-list-with-specific-length-and-sum',Random list with specific length and sum,1,0,1
'/questions/70933210/struct-for-parsing-google-distance-json-in-swif',struct for parsing google distance json in swif,0,0,1
'/questions/70933209/springboot-with-jsf-and-soap-interceptors-not-working-properly',Springboot with JSF and SOAP interceptors not working properly,0,0,1
'/questions/70933208/how-can-i-show-the-return-code-of-the-last-run-command-if-it-is-not-zero',How can I show the return code of the last run command if it is not zero?,0,0,1
'/questions/70933203/generate-points-on-a-cone-according-to-a-density-function',Generate points on a cone according to a density function,3,0,1
'/questions/70933202/how-to-include-context-variables-in-aws-api-eventbridge-integration-detail-body',How to include context variables in AWS API-EventBridge Integration Detail body,0,0,1
'/questions/70933201/how-to-merge-consecutive-merges-into-one-with-git',how to merge consecutive merges into one with git,0,0,1
'/questions/70933199/cannot-reach-pod-after-deploying-prometheus',Cannot reach pod after deploying prometheus,0,0,1
'/questions/70933198/pycachesim-libraries-problem-with-installation',Pycachesim libraries  problem with installation,0,0,1
'/questions/70933196/amplify-flutter-error-sqlitelog-5594-1-duplicate-column-name-when-using',Amplify Flutter : Error SQLiteLog( 5594) : (1) duplicate column name when using Graphql BelongsTo relationship,0,0,1
'/questions/70933191/how-can-i-make-my-bot-commands-only-run-on-servers-and-not-on-private-messages',How can I make my bot commands only run on servers and not on private messages?,1,0,1
'/questions/70933189/omnet-unable-to-configure-serverstandardhost-for-dynamic-ue',Omnet++: Unable to configure server(StandardHost) for Dynamic Ue,0,0,1
'/questions/70933188/importxml-data-by-excluding-fields-in-google-sheet',ImportXML data by excluding fields in Google Sheet,2,0,1
'/questions/70933183/ghc-stack-overflow-hook-doesnt-work-in-linux-dynamic-library',GHC stack overflow hook doesn't' work in Linux dynamic library,0,1,1
'/questions/70933181/sql-merging-results-from-two-tables-into-one-result',SQL: Merging results from two tables into one result,2,-1,1
'/questions/70933178/getting-currentscript-is-returning-typeerror',Getting currentScript is returning typeError,1,0,1
'/questions/70933176/await-not-waiting-for-other-awaits-to-finish-in-async-function',Await not waiting for other awaits to finish in Async function [duplicate],0,0,1
'/questions/70933173/c-keypress-event-output-function-in-the-same-time-issue',C++ Keypress Event & Output Function in the same time ISSUE,0,-2,1
'/questions/70933172/how-to-write-gitignore-so-that-it-only-includes-yaml-files-and-some-specific-fi',How to write .gitignore so that it only includes YAML files and some specific files?,2,0,1
'/questions/70933171/can-i-connect-browser-right-click-with-power-automate-script',Can I connect browser right-click with Power Automate script?,0,0,1
'/questions/70933168/how-to-calculate-change-with-glm-poisson-output',How to calculate % change with GLM Poisson output,0,0,1
'/questions/70933167/how-can-i-read-a-font-file-that-a-user-uploads',How can I Read a Font File That a User Uploads?,1,-1,1
'/questions/70933162/io-filestream-options-to-ignore-portions-of-the-file',IO.FileStream options to ignore portions of the file,0,0,1
'/questions/70933161/jinja2-for-loop-doesnt-follow-original-dictionary-order',Jinja2 for loop doesn't follow original dictionary order,0,0,1
'/questions/70933159/implicit-vs-explicit-into',Implicit vs explicit "into",1,1,1
'/questions/70933154/ecs-fargate-with-dockerized-container-nginx-not-loading-static-files',ECS Fargate with Dockerized container nginx not loading static files,0,0,1
'/questions/70933153/istio-ihave-about-70-services-in-a-namespace-that-some-connect-to-an-external',Istio - Ihave about 70 services in a namespace that some connect to an external DB but all seem to fail with sidecar injection,0,0,1
'/questions/70933152/find-specific-dates-between-2-dates',Find specific dates between 2 dates [closed],0,-3,1
'/questions/70933150/mysql-calls-from-php-server-works-intermittently-only-after-user-log-in',mysql calls from PHP server works intermittently (only after user log-in) [duplicate],0,0,1
'/questions/70933147/stream-events-via-event-hubs-to-self-managed-azure-elastic-stack',Stream events via Event Hubs to Self Managed Azure Elastic Stack,0,0,1
'/questions/70933146/arithmetic-with-a-set-number-of-user-input',Arithmetic with a set number of user input [closed],0,-4,1
'/questions/70933145/how-to-animate-one-line-while-keeping-the-other-line-static-in-rstudio-line-gr',How to animate one line while keeping the other line static in Rstudio? (line graph),0,0,1
'/questions/70933142/envoy-wasm-failing-to-load-due-to-missing-import-using-net-http-go-module',Envoy WASM failing to load due to missing import (using net/http Go module),0,0,1
'/questions/70933141/cmake-creating-a-serial-and-parallel-mpi-build-for-a-project',CMake: creating a serial and parallel (MPI) build for a project,1,2,1
'/questions/70933138/how-do-i-control-increase-and-descrease-of-sprite-spawning-in-pygame',How do I control increase and descrease of sprite spawning in PyGame?,0,0,1
'/questions/70933137/intellisense-for-python-apsw',Intellisense for Python APSW,0,0,1
'/questions/70933136/what-is-the-best-way-to-handle-large-asterisk-dial-plans-more-than-100-000-line',What is the best way to handle large Asterisk dial plans? More than 100 000 lines essentially,0,0,1
'/questions/70933134/send-subscribers-from-a-list-to-a-data-extension',Send subscribers from a list to a Data Extension,0,0,1
'/questions/70933130/how-to-find-all-chapters-with-different-numbers-using-regex-in-vs-code',How to find all chapters (with different numbers using regex in vs code?,0,0,1
'/questions/70933128/join-when-a-date-is-within-a-date-range-kusto-kql-azure-data-explorer',Join when a date is within a date range ( Kusto / KQL / Azure Data Explorer ),1,0,1
'/questions/70933126/could-someone-from-jfrog-join-the-discussion-around-testing-new-versions-of-pip',Could someone from JFrog join the discussion around testing new versions of pip?,1,0,1
'/questions/70933127/stopping-and-resuming-tutorial-using-intro-js',stopping and resuming tutorial using intro.js,0,0,1
'/questions/70933125/swiftui-move-transition-with-a-draw-limit',swiftUI move transition with a draw limit?,1,0,1
'/questions/70933123/runner-file-location-in-serenity-bdd',Runner file location in Serenity BDD,0,0,1
'/questions/70933120/nestjs-what-is-the-right-order-for-body-params-req-res',Nestjs What is the right order for @Body()  @Params(), @Req(), @Res(),2,0,1
'/questions/70933119/i-encountered-this-error-while-installing-react',I encountered this error while installing react,0,0,1
'/questions/70933025/more-than-15000-parse-tokens-have-been-presented',More than 15000 parse tokens have been presented,0,-1,1
'/questions/70933021/dont-let-user-create-multiple-objects-with-same-value',don't let user create multiple objects with same value,1,0,1
'/questions/70933018/how-to-identify-components-of-a-lump-sum-with-python',How to identify components of a lump sum with Python? [closed],0,-4,1
'/questions/70933017/send-images-with-hikari-python',Send Images with Hikari Python,0,0,1
'/questions/70933016/question-concerning-tokenizing-on-commas-when-string-has-single-quote',Question concerning tokenizing on commas when string has single quote [closed],0,-1,1
'/questions/70933014/how-to-use-columntransformer-to-return-a-dataframe',how to use ColumnTransformer() to return a dataframe?,1,0,1
'/questions/70933009/bash-use-argument-as-name-of-associative-array',bash - use argument as name of associative array [duplicate],1,-1,1
'/questions/70933008/efficient-way-to-subtract-arrays-and-get-index-of-resulting-subarray',Efficient way to subtract arrays and get index of resulting subarray,2,0,1
'/questions/70933007/i-cant-seem-to-make-my-html-work-with-a-form-method-to-submit-the-users-drag-dr',I can't seem to make my HTML work with a form method to submit the users drag/dropped image,0,1,1
'/questions/70933006/hibernate-with-maven-and-java-11-gives-org-hibernate-persister-entity-singletabl',Hibernate with Maven and Java 11 gives org.hibernate.persister.entity.SingleTableEntityPersister,0,0,1
'/questions/70933005/i-want-to-make-a-popup-appear-in-php',I want to make a popup appear in php,2,0,1
'/questions/70933003/how-to-make-python-go-through-urls-in-a-text-file-check-their-status-codes-and',How to make Python go through URLs in a text file  check their status codes, and exclude all ones with 404 error?,1,0,1
'/questions/70933001/this-expression-was-expected-to-have-type-system-string-but-here-has-type-str',This expression was expected to have type 'System.String' but here has type 'string',1,0,1
'/questions/70932999/error-er-no-such-table-table-managementapp-medicament-doesnt-exist',"Error: ER_NO_SUCH_TABLE: Table 'managementapp.medicament' doesn't exist",0,0,1
'/questions/70932998/react-native-chart-kit-export-to-pdf',React native chart kit export to pdf,0,0,1
'/questions/70932997/background-reveal-javascript-not-working-properly',Background reveal javascript not working properly,2,0,1
'/questions/70932993/how-to-git-rid-of-the-white-space-on-my-webpage-im-working-with-handlebars-js',how to git rid of the white space on my webpage I'm working with handlebars.js?,0,0,1
'/questions/70932990/transform-list-into-dict',Transform list into dict [duplicate],1,-1,1
'/questions/70932989/problem-in-finding-the-angle-and-distance-with-the-math-library-in-lua',Problem in finding the angle and distance with the Math. library in LUA?,1,0,1
'/questions/70932986/enable-to-access-jenkins-installed-in-virtualbox',Enable to access jenkins installed in virtualbox,0,0,1
'/questions/70932985/svelte-make-then-value-of-await-statement-reactive',Svelte make {:then} value of {#await} statement reactive,1,0,1
'/questions/70932984/umbraco-9-remove-login-authentication',Umbraco 9 - Remove login authentication,0,0,1
'/questions/70932981/there-are-examples-in-javascript-to-managing-browser-memory-on-browser-console',There are examples in javascript to managing browser memory  on browser console?,0,-1,1
'/questions/70932976/flutter-how-to-change-string-alphabet-by-index',Flutter how to change string alphabet by index,1,0,1
'/questions/70932975/accessing-data-in-listbox-columns-not-displayed',Accessing Data in Listbox columns not displayed,0,0,1
'/questions/70932972/how-to-check-discord-webhook-value',How to check discord webhook value,0,0,1
'/questions/70932971/next-js-getstaticprops-getserversideprops-best-use-case',Next.js getStaticProps/getServerSideProps best use case,0,1,1
'/questions/70932968/gradle-exclude-java-11-module-java-xml',Gradle exclude java 11 module java.xml,0,0,1
'/questions/70932967/how-to-structure-chat-application-using-firebase-realtime-database-to-incorporat',How to structure chat application using Firebase Realtime Database to incorporate user data?,1,0,1
'/questions/70932966/replace-extension-on-thumbnails',Replace extension on thumbnails,1,0,1
'/questions/70932963/how-to-bundle-two-python-apps-created-with-pyinstaller',How to Bundle two Python Apps Created with PyInstaller,0,0,1
'/questions/70932962/does-anyone-know-why-this-isnt-working-properly',Does anyone know why this isnt working properly?,3,-2,1
'/questions/70932960/graph-component-not-charting-data-chart-js',Graph Component not charting data (Chart.js),0,0,1
'/questions/70932952/problems-trying-to-use-project-loom-virtual-threads-with-openjdk-19-loom-java',Problems trying to use Project Loom/Virtual Threads with OpenJDK 19-loom JAVA,0,0,1
'/questions/70932951/transform-data-from-python-to-c',Transform data from Python to C++ [closed],0,-5,1
'/questions/70932948/what-does-the-tag-represent-in-log-code-in-android',what does the TAG represent in Log code in android?,1,0,1
'/questions/70932947/convert-a-string-of-hex-to-multiple-integers',Convert a string of HEX to multiple integers,1,0,1
'/questions/70932946/how-to-create-web-socket-server-in-electron-js',How to create web socket server in Electron JS?,0,0,1
'/questions/70932945/wix-add-values-to-listbox',Wix add values to listbox,0,0,1
'/questions/70932944/i-am-not-able-to-connect-to-google-cloud-memory-store-from-spring-boot',I am not able to connect to Google Cloud Memory Store from Spring Boot,1,0,1
'/questions/70932941/swing-window-not-opening',Swing window not opening,1,-1,1
'/questions/70932939/in-a-pandas-data-frame-is-there-a-way-to-find-the-amount-of-duplicate-pairings',In a pandas data frame  Is there a way to find the amount of duplicate pairings that exist between rows,1,0,1
'/questions/70932933/accessing-multiple-values-of-array-and-returning-them-concatenated-or-as-string',accessing multiple values of array and returning them concatenated or as string,4,-3,1
'/questions/70932932/google-sign-in-provider-without-asp-net-core-identity',Google sign-in provider without ASP.NET Core Identity,1,0,1
'/questions/70932931/i-need-a-way-to-calculate-volume-from-picture-taked-from-smart-phone-camera',I need a way to calculate volume from picture taked from Smart phone camera,0,0,1
'/questions/70932930/how-to-get-workspace-name-inside-a-python-notebook-in-databricks',How to get workspace name inside a python notebook in databricks,1,0,1
'/questions/70932928/return-another-column-value-based-on-max-value-from-column',Return another column value based on Max value from Column [duplicate],1,0,1
'/questions/70932927/find-specific-text-and-get-that-text-in-string',Find specific text and get that text in string [duplicate],0,-1,1
'/questions/70932926/problem-with-discord-bot-and-connecting-to-a-websocket',Problem with discord bot and connecting to a websocket,0,0,1
'/questions/70932925/multiple-ontologies-reuse-which-partially-sourced-from-a-more-specific-domain',Multiple Ontologies Reuse (which partially sourced from a more specific domain),0,0,1
'/questions/70933118/rfid-data-should-be-written-into-input-field',RFID Data should be written into input field,0,0,1
'/questions/70933117/how-to-set-exact-animation-start-time-in-unity3d-like-audiosource-playscheduled',How to set exact animation start time in Unity3d like AudioSource.PlayScheduled,0,0,1
'/questions/70933116/property-proxyconfig-is-not-allowed-angular',Property proxyConfig is not allowed. Angular,1,0,1
'/questions/70933115/segmenting-elements-in-a-list-and-find-their-statistics',segmenting elements in a list and find their statistics,1,0,1
'/questions/70933113/what-happens-when-i-provide-type-hint-but-dont-initialize',What happens when I provide type hint but don't initialize?,0,0,1
'/questions/70933111/how-to-index-on-an-array-of-jsonb-objects-to-get-distinct-values',How to index on an array of jsonb objects to get distinct values,0,0,1
'/questions/70933109/flutter-null-check-operator-used-on-a-null-value',Flutter "Null check operator used on a null value" [duplicate],0,0,1
'/questions/70933108/passing-object-from-php-to-javascipt',Passing object from PHP to Javascipt,0,1,1
'/questions/70933103/how-to-get-rows-and-columns-from-text-block',How to get rows and columns from text block [duplicate],2,0,1
'/questions/70933102/are-there-limitations-on-terraform-variable-expansion',Are there limitations on Terraform variable expansion?,0,0,1
'/questions/70933101/woocommerce-purchases-are-very-slow',WooCommerce purchases are very slow,2,0,1
'/questions/70933100/swiftui-variable-size-array',Swiftui variable size array,1,0,1
'/questions/70933099/elasticsearch-query-with-nested-filter-and-nested-aggregation',ElasticSearch query with nested filter and nested aggregation,0,0,1
'/questions/70933097/how-can-i-detect-certain-collision-detections-in-javascript',How can I detect certain collision detections in javascript? [closed],0,-1,1
'/questions/70933096/how-to-show-on-the-x-axis-the-only-corresponding-years',How to show on the x-axis the only corresponding years?,1,0,1
'/questions/70933095/flask-sqlalchemy-connection-pools-and-transactions',Flask-Sqlalchemy connection pools and transactions,0,0,1
