Question Link, Question,Answer Count,Upvotes,Count
'/questions/70926856/java-generatedvalue-return-0-therefore-a-nullpointer',java generatedvalue return 0 Therefore a nullpointer,0,0,1
'/questions/70926855/equivalent-of-getuid-for-windows-in-python',Equivalent of getuid() for windows in python [duplicate],0,0,1
'/questions/70926852/why-is-my-debugger-not-capable-of-showing-my-variables',Why is my debugger not capable of showing my variables?,0,0,1
'/questions/70926850/appsscript-scanning-a-google-sheets-table-and-drop-down-cell-to-update-the-tab',AppsScript - Scanning a Google Sheets table and drop down cell to update the table,0,0,1
'/questions/70926848/some-assembly-binding-redirects-are-not-generated-automatically-even-if-autogene',Some assembly binding redirects are not generated automatically even if AutoGenerateBindingRedirects is set to true,0,0,1
'/questions/70926847/simple-localserver-for-test-jwt-form-register-and-login-request',Simple LocalServer for test jwt (form register and login request),1,0,1
'/questions/70926846/how-can-i-find-the-static-ip-of-airflow-web-ui-cloud-composer',How can I find the static IP of Airflow Web UI? / Cloud Composer,1,1,1
'/questions/70926845/php-mysql-dynamic-link-from-mysql-table',PHP/Mysql dynamic link from mysql table,0,-3,1
'/questions/70926842/i-keep-getting-table-or-view-does-not-exist-in-oracle-live',I keep getting "table or view does not exist " in oracle- live,1,0,1
'/questions/70926836/cypress-how-to-intercept-websocket-request',Cypress - how to intercept websocket request?,0,0,1
'/questions/70926834/is-there-a-way-to-split-up-columns-in-python',Is there a way to split up columns in python? [duplicate],0,0,1
'/questions/70926832/pyspark-merge-schema-option-with-parquet-files',Pyspark Merge Schema Option with Parquet Files,0,0,1
'/questions/70926829/is-there-a-way-to-fork-a-repo-but-also-keep-the-original-repositorys-issues-gi',Is there a way to fork a repo but also keep the original repository's issues (GitHub)? (Issues are deleted as soon as you fork),1,-1,1
'/questions/70926828/nan-values-in-satellite-data',NaN values in satellite data,0,-2,1
'/questions/70926827/changing-the-default-laravel-table-names-from-plurals-to-own-custom-names',changing the default Laravel table names from plurals to own custom names,2,0,1
'/questions/70926826/c-test-for-validation-utf-8',C++ test for validation UTF-8,2,1,1
'/questions/70926825/how-to-change-time-in-node-scheduler-while-un-time',How to change time in node-scheduler while un time,0,0,1
'/questions/70926821/modelcache-safegetandroidprojectresult-androidprojectgetndkversion-must',ModelCache.safeGet(androidProjectResult.androidProject::getNdkVersion  "") must not be null,0,0,1
'/questions/70926710/is-it-a-good-idea-to-handle-all-requests-and-responses-server-side-and-all-api',Is it a good idea to handle all requests and responses (server side) and all API calls (frontend side) using try-catch blocks?,1,-2,2
'/questions/70926709/sequelize-cli-migration-still-using-previously-renamed-files-in-addition-off-new',Sequelize-cli migration still using previously renamed files in addition off new files,0,0,1
'/questions/70926704/how-to-programmatically-duplicate-and-then-modify-an-embedded-svg-image-using',How to programmatically duplicate (and then modify) an embedded svg image using javascript,1,0,1
'/questions/70926703/matplotlib-plot-opening-angle-of-radar-sensor-in-3d-space',matplotlib plot opening angle of radar sensor in 3D space,0,0,1
'/questions/70926702/algorithm-to-delete-node-from-singly-linked-list-in-a-given-position',algorithm to delete node from singly linked list in a given position,0,0,1
'/questions/70926701/run-script-which-is-stored-at-gcs-airflow-vm',Run script which is stored at GCS | Airflow | VM,2,0,1
'/questions/70926697/move-selected-2d-object-closer-to-camera',Move selected 2D object closer to camera,0,0,1
'/questions/70926695/logging-operations-to-syslog-server-using-java',Logging operations to syslog server using java,0,0,1
'/questions/70926689/how-can-i-fix-this-issue-where-gridsearchcv-fit-gets-stuck',How can I fix this issue where GridSearchCV.fit gets stuck?,0,0,1
'/questions/70926687/ansible-role-structuring',Ansible Role Structuring,1,0,1
'/questions/70926680/functional-component-is-not-re-rendering',Functional component is not Re-rendering,1,0,1
'/questions/70926679/how-can-i-move-a-matrix-in-excel-one-column-to-the-right-and-input-strings',How can I move a matrix in excel one column to the right and input strings?,1,0,1
'/questions/70926677/quantlib-python-how-to-specify-to-includesettlementdateflows-in-discountingbon',Quantlib Python - how to specify to includeSettlementDateFlows in DiscountingBondEngine,0,0,1
'/questions/70926675/populate-bash-array-with-any-amount-of-arguments',Populate bash array with any amount of arguments,1,0,1
'/questions/70926674/change-woocommerce-edit-order-link-with-get-post-edit-link-filter-isnt-working',change woocommerce edit order link with get_post_edit_link filter isn't working,0,0,1
'/questions/70926673/cant-relocate-with-tortoisesvn-1-14',Can't relocate with TortoiseSVN 1.14,1,0,1
'/questions/70926671/how-to-set-the-language-of-a-json-file-in-notepad-automatically-to-json',How to set the Language of a .json file in Notepad++ automatically to JSON?,0,0,1
'/questions/70926670/layer-normalization-weight-re-scaling-and-re-centering',Layer normalization Weight re-scaling and re-centering,0,0,1
'/questions/70926667/why-the-try-catch-is-not-working-with-out-of-bound-arrays',why the try catch is not working with out of bound arrays?,0,-3,1
'/questions/70926666/cant-integrate-a-create-react-app-project',Can't integrate a Create-react-app project,0,0,1
'/questions/70926664/how-can-i-find-an-element-by-name-in-a-xml-file',How can I find an element by name in a XML file,0,0,1
'/questions/70926663/importerror-the-enchant-c-library-was-not-found-and-maybe-needs-to-be-install',ImportError: The 'enchant' C library was not found and maybe needs to be installed. Docker,0,-2,1
'/questions/70926660/cannot-convert-from-system-collections-generic-listobject-to-unityengine-ob',Cannot convert from 'System.Collections.Generic.List<Object>' to 'UnityEngine.Object',1,-3,1
'/questions/70926659/how-to-set-onselectionchange-in-word-document-app-script',How to set onselectionchange in word document app script,0,-1,1
'/questions/70926658/collecting-and-storing-html-elements',Collecting and storing HTML elements,5,-1,1
'/questions/70926657/c-sharp-is-it-safe-to-concatenate-constant-strings-to-form-a-sql-query',C# Is it safe to concatenate constant strings to form a SQL Query?,2,1,1
'/questions/70926654/aws-nat-gateway-needed-despite-privatelink',AWS - NAT Gateway needed despite PrivateLink,0,0,1
'/questions/70926653/data-encoding-issue-in-multipart-form-data',Data encoding issue in multipart/form-data,0,0,1
'/questions/70926652/receiving-an-error-collection-was-modified-enumeration-operation-may-not-execu',Receiving an error  Collection was modified; enumeration operation may not execute, but I don't know what I am doing wrong and where?,2,0,1
'/questions/70926650/filtering-by-multiple-values-inside-attribute',Filtering by multiple values inside attribute,0,0,1
'/questions/70926648/messagequeue-receive-timeout-exception',MessageQueue.Receive TimeOut Exception,0,-1,1
'/questions/70926645/upgrading-spring-boot-2-5-2-to-2-6-3-breaks-all-projection-based-jpa-queries',Upgrading Spring Boot 2.5.2 to 2.6.3 breaks all projection based JPA queries,0,0,1
'/questions/70926644/data-from-plist-value-of-optional-type-url-must-be-unwrapped-to-a-value-of',Data from plist - Value of optional type 'URL?' must be unwrapped to a value of type 'URL',0,-1,1
'/questions/70926643/is-any-method-to-change-country-when-verify-play-console',Is Any Method To Change Country When Verify Play Console?,0,0,1
'/questions/70926642/can-we-use-the-command-line-to-get-some-information-within-karate-framework',Can we use the command line to get some information within karate framework? [duplicate],0,1,1
'/questions/70926635/how-to-avoid-memory-leak-when-using-threading-timer',How to avoid memory leak when using Threading.Timer,0,2,1
'/questions/70926634/why-when-i-apply-dataframe-sub-i-get-the-new-df-with-a-higher-number-of-column',Why when I apply DataFrame.sub() I get the new DF with a higher number of columns?,2,1,1
'/questions/70926631/read-file-and-write-blocks-of-lines-to-new-files-using-loop',Read file and write blocks of lines to new files using loop,3,0,1
'/questions/70926630/boto3-paginator-check-multiple-values',boto3 paginator  check multiple values,1,0,1
'/questions/70926629/docker-run-nodejs-script-on-a-remote-server-and-store-output-files-in-a-host-sys',Docker run nodejs script on a remote server and store output files in a host system,2,-1,1
'/questions/70926626/how-to-use-image-binary-data-from-php-backend-in-navigator-share-files-option',How to use image binary data from PHP backend in navigator.share files option?,0,-1,1
'/questions/70926625/which-side-should-be-the-owning-side-in-a-1n-relationship',Which side should be the owning side in a 1:n relationship?,0,0,1
'/questions/70926624/calculating-square-roots-using-newtons-method',Calculating square roots using Newton's method [closed],0,-7,1
'/questions/70926622/small-fix-on-expansion-tile-with-json-data',Small fix on expansion tile with json data,0,0,1
'/questions/70926617/aosp-build-replace-existing-aosp-module-with-a-custom-one',AOSP build: Replace existing AOSP module with a custom one,0,0,1
'/questions/70926615/lsp-metals-submode-fails-to-detect-metals-already-installed-in-the-system',Lsp-metals submode fails to detect metals already installed in the system,0,0,1
'/questions/70926614/how-can-i-send-large-data-with-ajax',How can I send large data with ajax? [closed],1,0,1
'/questions/70926611/how-to-use-python-into-an-existing-php-web-application',How to use python into an existing php web application?,1,-1,1
'/questions/70926609/octopus-deploy-runbook-to-turn-on-https-only-setting-on-azure-app-services',Octopus deploy runbook to turn on "https only" setting on azure app services,0,0,1
'/questions/70926603/symfony-stimulus-bridge-merge-controllers-from-different-locations',Symfony Stimulus-Bridge merge controllers from different locations,0,-2,1
'/questions/70926816/how-to-get-all-the-content-using-fprintf-in-c',How to get all the content using fprintf in c,1,-1,1
'/questions/70926808/add-dark-and-highlight-effect-on-image-like-apple-native-app-dark-and-highlight',Add Dark and Highlight effect on image Like apple native app Dark and Highlight effect,0,1,1
'/questions/70926806/err-connection-refused-axios-localhost-connection-failure',ERR_CONNECTION_REFUSED axios localhost connection failure,0,0,1
'/questions/70926804/typescript-only-allow-circular-reference-keys-from-the-same-object',typescript only allow circular reference keys from the same object,1,0,1
'/questions/70926803/nesting-choice-and-sequence-to-create-arbitrary-element-selection-in-xsd',nesting <choice> and <sequence> to create arbitrary element selection in XSD,0,0,1
'/questions/70926799/centos-through-vm-no-urls-in-mirrorlist',Centos through VM - no URLs in mirrorlist [closed],3,8,1
'/questions/70926798/how-to-activate-intel-mkl-in-azure-function',How to activate Intel MKL in Azure function,0,0,1
'/questions/70926797/how-to-get-methods-properties-values-php',How to get methods properties values - PHP,1,0,1
'/questions/70926793/flutter-putting-data-from-api-in-expansion-tile',flutter putting data from api in expansion tile,1,0,1
'/questions/70926790/sql-query-to-perform-below-operations',Sql Query to perform below operations [closed],0,-1,1
'/questions/70926787/saving-pandas-dataframe-to-django-model-with-logic-to-avoid-storing-duplicate-en',Saving pandas dataframe to django model with logic to avoid storing duplicate entries for a field in database,0,0,1
'/questions/70926785/loop-ansible-hostvars-from-inventory-in-jinjar2-template',Loop Ansible hostvars from inventory in jinjar2 template,1,1,1
'/questions/70926784/vim-airline-some-space-at-the-bottom',vim.airline  some space at the bottom,0,0,1
'/questions/70926781/how-to-do-forecasting-with-very-less-data-point',How to do forecasting with very less data point? [closed],0,0,1
'/questions/70926779/is-it-possible-to-export-metrics-from-weavescope',Is it possible to export metrics from Weavescope?,0,0,1
'/questions/70926778/cannot-obtain-the-required-interface-iid-icolumnsinfo-from-ole-db-provider',Cannot obtain the required interface ("IID_IColumnsInfo") from OLE DB provider "BULK" for linked server "(null)",0,0,1
'/questions/70926772/php-fopenfilename-w-creates-file-in-local-environment-but-doesnt-creat',PHP - fopen("filename"  "w") creates file in local environment but doesn't create document in the hosting server,2,0,1
'/questions/70926769/use-spaces-in-parameter-used-in-script-called-by-a-command',Use spaces in parameter used in script called by a command,2,0,1
'/questions/70926768/what-is-the-best-way-to-generate-random-ships-in-an-array-in-python',What is the best way to generate random ships in an array in Python?,2,0,1
'/questions/70926765/devexpress-avgaggregator-and-remoteavgaggregator-not-using-ienumerable-average',DevExpress / AvgAggregator and RemoteAvgAggregator not using IEnumerable Average(),0,0,1
'/questions/70926764/django-query-list-order-changes-in-local-and-production',Django query list order changes in local and production,0,0,1
'/questions/70926763/list-c-sharp-find-element-by-id-in-list-with-class-items',List C# find element by id in list with class items [duplicate],1,0,1
'/questions/70926759/input-value-is-not-recognized',<input> value is not recognized,2,1,1
'/questions/70926758/getting-app-size-through-flutter-application',Getting app size through flutter application,0,0,1
'/questions/70926756/excel-vba-when-running-a-stored-sub-procedure-getting-runtime-error-1004',Excel VBA - when running a stored sub procedure getting runtime error 1004,1,0,1
'/questions/70926753/no-filesystem-for-scheme-abfss-with-spark-on-k8s-operator',No Filesystem for scheme 'abfss' with spark-on-k8s Operator,0,0,1
'/questions/70926750/sql-syntax-change-with-h2-version-update',SQL syntax change with H2 version update,1,0,1
'/questions/70926749/my-dto-showing-null-for-one-object-and-the-correct-value-for-the-other',My DTO showing null for one object and the correct value for the other,0,0,1
'/questions/70926748/wordpress-installation-error-warning-call-user-func-array-expects-parameter',WordPress Installation Error - Warning: call_user_func_array() expects parameter 1 to be a valid callback  function '_add_default_theme_supports' not,1,0,1
'/questions/70926746/i-want-to-convert-multiple-columns-into-rows-but-along-with-its-corresponding-d',I want to convert multiple columns into rows but along with it's corresponding data,1,0,1
'/questions/70926744/how-can-i-create-my-own-dualswipelayout-which-can-be-swiped-from-both-sides-lef',How can i create my own DualSwipeLayout which can be swiped from both sides (left and right),0,0,1
'/questions/70926743/hololens2-application-made-with-unity-throws-exception-could-not-create-a-devic',HoloLens2 Application made with unity throws Exception "Could not create a device for ''Hand - Right (XRInputV1)",0,-1,1
'/questions/70926742/how-to-work-with-exclusive-and-shared-fe-be-databases',How to work with exclusive and shared FE  BE databases,0,0,1
'/questions/70926740/editing-specific-element-of-an-array-of-a-particular-collection-mongodb',Editing specific element of an array of a particular collection - mongoDb,1,0,1
'/questions/70926737/aws-neptune-opencypher-vs-gremlin',AWS Neptune / OpenCypher vs Gremlin,0,0,1
'/questions/70926736/validate-only-a-part-of-xml-file-using-an-xsd-and-display-errors',Validate only a part of XML file using an XSD and display errors,0,0,1
'/questions/70926734/styles-in-headerleftconatinerstyle-in-react-native-not-working',styles in headerLeftConatinerStyle in react native not working,0,0,1
'/questions/70926732/map-or-match-returning-futurelist-when-expected-to-return-list',.map or match returning Future[List] when expected to return List,2,-1,1
'/questions/70926731/on-clicking-try-button-i-want-to-add-split-background-also-want-to-change-text-c',On Clicking TRY button I want to add split background also want to change text color inside circle every second. Take color : red  blue,0,-1,1
'/questions/70926724/vbscript-in-sap-using-power-automate-desktop-application',VBScript in SAP using Power Automate Desktop Application [closed],0,-1,1
'/questions/70926722/how-can-i-manage-productflavors-while-i-use-amplify-in-the-android-project',How can I manage productFlavors while I use amplify in the android project?,0,0,1
'/questions/70926721/gpg-with-error-no-name-when-importing-key-from-keyserver',gpg with error "no name"  when importing key from keyserver,0,0,1
'/questions/70926719/is-it-possible-to-send-a-ping-opcode-using-javascript-websocket',Is it possible to send a ping opcode using javascript Websocket?,0,0,1
'/questions/70926718/upload-file-in-laravel-very-slow',Upload File in laravel very slow,2,0,1
'/questions/70926717/why-does-my-default-django-admin-page-look-terrible-when-deployed-to-heroku',Why does my default django admin page look terrible when deployed to heroku?,0,0,1
'/questions/70926714/is-it-possible-to-send-multiple-models-to-a-partial-in-razor-pages',Is it possible to send multiple models to a partial in Razor Pages?,0,0,1
'/questions/70926713/set-inputfields-values-with-jquery-if-text-contains-string',Set Inputfields Values with Jquery if Text contains String,1,0,1
'/questions/70926712/javascript-var-let-and-asynchronous-javascript',javascript var   let and asynchronous javascript [duplicate],0,-1,1
'/questions/70926711/how-the-baritem-indent-interval-is-measured-in-devexpress-wpf',How the BarItem Indent interval is measured in Devexpress WPF,0,0,1
'/questions/70926491/check-if-firestore-is-reachable-internet-is-available-and-server-is-online',Check if firestore is reachable (Internet is available and server is online),0,0,1
'/questions/70926488/bootstrapswitch-remove-eventlistener',bootstrapSwitch - remove eventlistener,0,0,1
'/questions/70926486/need-some-help-converting-a-c-sharp-code-snippet-to-vb-net',Need some help converting a c# code snippet to VB.Net,2,0,1
'/questions/70926485/how-to-search-a-term-within-old-commit-content-showing-it-within-context',How to search a term within old commit content  showing it within context?,2,0,1
'/questions/70926484/cost-estimation-of-a-web-request-based-on-incoming-headers',Cost estimation of a web request based on incoming headers,0,0,1
'/questions/70926483/remove-trailing-0-from-api-returned-double',Remove trailing .0 from API returned `double`,1,0,1
'/questions/70926481/testing-a-function-that-writes-in-file',Testing a function that writes in file,0,-1,1
'/questions/70926479/fitting-cumulative-gaussan-distribution',Fitting cumulative gaussan distribution,0,0,1
'/questions/70926475/bat-file-closes-immediately-despite-the-pause-command',Bat file closes immediately despite the pause command [closed],1,-2,1
'/questions/70926474/cilium-installation-on-rancher-desktop',Cilium installation on rancher-desktop,0,0,1
'/questions/70926472/how-to-update-dynamic-variable-in-array-after-change-vue',How to update dynamic variable in array after change VUE,2,0,1
'/questions/70926467/pagination-in-dynamodb-nodejs',Pagination in DynamoDB nodejs,1,1,1
'/questions/70926466/complex-formatcondition-in-excel-c-sharp-interop',Complex FormatCondition in excel c# interop,0,0,1
'/questions/70926463/cannot-resolve-configuration-property-spring-h2-console-enabled',Cannot resolve configuration property 'spring.h2.console.enabled',0,0,1
'/questions/70926462/tkinter-gui-returning-the-same-prediction-value-for-keras-model',Tkinter GUI returning the same prediction value for Keras model,0,0,1
'/questions/70926459/how-to-share-the-x-axis-in-these-stack-plots',How to share the x-axis in these stack plots,1,0,1
'/questions/70926458/question-about-the-right-use-of-lstrip-in-python',Question about the right use of lstrip() in Python,0,-1,1
'/questions/70926453/problem-dynamically-changing-the-forms-state',problem dynamically changing the form's state,3,0,1
'/questions/70926450/how-to-make-list-like-on-picture-with-css',How to make list like on picture with css? [closed],2,-4,1
'/questions/70926449/how-to-return-a-variable-from-the-event-function',How to return a variable from the event function?,2,-1,1
'/questions/70926446/how-to-optimise-an-arbitrary-function-with-tensorflow-keras',How to optimise an arbitrary function with TensorFlow/Keras?,0,0,1
'/questions/70926445/will-firebase-be-able-to-handle-huge-traffic',Will firebase be able to handle huge traffic?,1,1,1
'/questions/70926444/android-data-binding-error-non-static-variable-r-cannot-be-referenced-from-a-s',Android Data Binding Error : non-static variable R cannot be referenced from a static context,0,0,1
'/questions/70926443/typescript-list-files-in-web-folder',TypeScript: list files in web folder,1,1,1
'/questions/70926442/bamboo-slow-building-should-be-1-min-but-is-10-minute',Bamboo slow building (should be 1 min but is 10 minute),0,0,1
'/questions/70926440/is-it-an-infinite-loopingpython-3',is it an infinite looping?(Python 3),1,-2,1
'/questions/70926438/java-8-how-to-solve-this-problem-using-in-java-8',JAVA 8 -How to solve this problem using in java 8 [closed],0,-6,1
'/questions/70926437/invalid-csrf-token-found-spring-boot-and-axios',Invalid CSRF token found - Spring Boot and Axios,1,0,1
'/questions/70926434/how-do-i-use-access-token-that-ive-obtained-via-instagram-api',How do i use Access Token that I've obtained via Instagram API?,0,-2,1
'/questions/70926432/how-to-mount-a-windows-share-to-a-pod-and-into-linux-container-inside-a-linux-ho',How to mount a windows share to a pod and into linux container inside a linux host (Windows share is behind proxy auth.),1,0,1
'/questions/70926431/replace-with-sed',Replace with sed [closed],0,-1,1
'/questions/70926424/google-maps-only-showing-first-time-my-android-app-is-installed',Google maps only showing first time my android app is installed,0,0,1
'/questions/70926422/can-i-count-the-number-of-requests-sent-to-my-app-running-on-ubuntu-and-nginx',Can I count the number of requests sent to my app running on Ubuntu and Nginx?,0,0,1
'/questions/70926421/error-failed-building-wheel-for-quadprog-ubuntu-python',Error: Failed building wheel for quadprog (Ubuntu  python),0,0,1
'/questions/70926418/flutter-chromesafaribrowser-launching-with-default-browser-settings',Flutter ChromeSafariBrowser launching with default browser settings,0,0,1
'/questions/70926417/dpll-result-is-entailed',DPLL result is entailed?,0,0,1
'/questions/70926415/ansible-nclu-module-net-show-permissions',Ansible NCLU module net show permissions,0,0,1
'/questions/70926410/append-table-row-to-existing-table-php-javascript',Append Table row to existing Table PHP  Javascript,2,-1,1
'/questions/70926409/sql-server-reference-outer-values-from-a-nested-table',SQL Server: Reference outer values from a nested table,0,-3,1
'/questions/70926408/how-to-create-a-model-from-the-values-entered-by-the-user',How to create a model from the values entered by the user?,1,0,1
'/questions/70926406/group-values-inside-a-loop-and-return-it-as-an-object-with-typescript',Group values inside a loop and return it as an object with typescript,2,0,1
'/questions/70926404/extend-hide-row-with-multiple-child-table',Extend/Hide Row with multiple child table,0,0,1
'/questions/70926403/how-to-reset-files-with-only-whitespace-changes-in-git',How to reset files with only whitespace changes in git,0,0,1
'/questions/70926401/how-to-exclude-sitemap-xml-from-caching-in-swift-performance-plugin',How to exclude sitemap.xml from caching in swift performance plugin?,1,0,1
'/questions/70926400/splitting-a-list-into-other-lists-if-a-full-stop-is-found',Splitting a list into other lists if a full stop is found,8,-1,1
'/questions/70926399/mysql-full-text-inflectional-forms-of-words',MySQL: Full-Text inflectional forms of words? [duplicate],0,0,1
'/questions/70926398/how-to-dismiss-notification-since-android-12',How to dismiss notification since Android 12?,0,0,1
'/questions/70926397/is-it-expected-that-a-custom-component-derived-from-inputnumbert-only-binds-on',Is it expected that a custom component derived from InputNumber<T> only binds one-way?,1,0,1
'/questions/70926394/django-mptt-tag-recursetree-is-there-any-counter-like-forloop-counter-or-we-h',django mptt tag recursetree => is there any counter like forloop.counter or we have to declare a counter variable,1,0,1
'/questions/70926393/mocking-new-object-method-call-in-junit5',Mocking new object method call in Junit5,0,0,2
'/questions/70926392/sql-search-in-json-values-contains-word',SQL Search in JSON values contains word,1,0,1
'/questions/70926389/how-to-handle-a-bearer-token-in-k6',How to handle a Bearer token in K6,0,0,1
'/questions/70926388/django-not-calling-function-from-urls-py',Django not calling function from urls.py,0,0,1
'/questions/70926384/read-datatable-rows-when-postback-razor-pages',Read Datatable Rows when postback Razor Pages,1,0,1
'/questions/70926383/is-it-valid-to-compare-2-strings-using-type-punning',Is it valid to compare 2 strings using type punning?,2,-2,1
'/questions/70926382/file-does-not-exist-but-its-there-and-multiple-ambiguous-overloads-found-for',File does not exist (but it's there) and Multiple ambiguous overloads found for "AddPicture" and the argument count: "2",1,0,1
'/questions/70926380/valueerror-inputs-have-incompatible-shapes-received-shapes-20-20-16-and-2',ValueError: Inputs have incompatible shapes. Received shapes (20  20, 16) and (22, 22, 16),1,1,1
'/questions/70926378/python-need-to-retrieve-country-contour-coordinates',PYTHON Need to retrieve country contour coordinates,0,0,1
