Question Link, Question,Answer Count,Upvotes,Count
'/questions/70936479/aws-guard-duty-supressed-findings',AWS guard duty supressed Findings,0,0,1
'/questions/70936478/creating-lists-while-code-is-running-and-adding-them-to-an-list-parent',Creating lists while code is running and adding them to an List Parent,2,0,1
'/questions/70936477/memory-problem-when-viewing-pdfdocument-swift',Memory problem when viewing PDFDocument Swift,0,0,1
'/questions/70936475/runtimeerror-dictionary-changed-size-during-iteration-but-its-not-changed-in',"RuntimeError: dictionary changed size during iteration" but it's not changed in the loop,0,0,1
'/questions/70936473/at-least-one-of-the-optional-fields',At least one of the optional fields,0,0,1
'/questions/70936472/flutter-get-it-register-multiple-apis-in-repo',Flutter get_it - Register multiple APIs in repo,1,2,1
'/questions/70936471/how-to-run-an-if-statement-asynchronously',How to run an if statement asynchronously,2,0,1
'/questions/70936470/group-by-django-queryset-by-a-foreignkey-related-field',Group By Django queryset by a foreignkey related field,0,0,1
'/questions/70936469/multiple-post-from-a-save-button-handling-in-a-angular-application',Multiple Post from a SAVE button handling in a Angular application,0,0,1
'/questions/70936468/ionic-position-errorapplication-does-not-have-sufficient-geolocation-permissi',Ionic - Position error:application does not have sufficient geolocation permission,0,0,1
'/questions/70936467/i-want-to-get-new-or-old-values-dynamically-in-oracle-trigger-pl-sql',I want to get new or old values dynamically in oracle Trigger pl/sql,0,0,1
'/questions/70936466/how-to-set-timezone-in-local-variable-using-python',how to set timezone in local variable using python?,0,0,1
'/questions/70936463/how-to-modify-a-redux-variable-state-from-react-component-with-a-button-click',How to modify a redux variable state from react component with a button click?,0,0,1
'/questions/70936462/trouble-getting-list-of-words-given-a-list-of-available-letters-for-each-charact',Trouble getting list of words given a list of available letters for each character (Python),1,2,1
'/questions/70936461/how-to-get-mongodb-collections-based-on-two-column-values',How to get mongodb collections based on two column values,1,0,1
'/questions/70936457/how-to-fix-ceph-warning-storage-filling-up',how to fix ceph warning "storage filling up",0,0,1
'/questions/70936456/how-to-write-the-regex-which-detects-9-digit-number-only-and-should-not-consider',How to write the regex which detects 9 digit number only and should not consider if it has a X or x preceded to that number and mask first 5 digit?,0,-4,1
'/questions/70936455/anyone-knows-if-we-can-get-the-step-function-arn-from-lambda',Anyone knows if we can get the step function arn from lambda,0,0,1
'/questions/70936454/how-to-access-formstate-errors-when-using-formprovider',How to access formState.errors when using FormProvider,0,0,1
'/questions/70936452/i-want-the-circles-to-be-filled-as-in-the-picture-below-slider-android-java',I want the circles to be filled as in the picture below. slider. android java,0,0,1
'/questions/70936451/hi-id-like-to-ask-a-question-about-directory-in-python',Hi. I'd like to ask a question about directory in python [duplicate],0,0,1
'/questions/70936447/flutter-onpressed-utilize-full-index-from-list',Flutter Onpressed Utilize Full Index from List,1,0,1
'/questions/70936444/display-pdf-in-react-js-from-c-sharp-api',display pdf in react js from C# api,0,0,1
'/questions/70936442/if-string-is-immutable-in-java-then-why-does-replaceall-method-can-change-the',If String is immutable in java  then why does replaceAll() method can change the String? [duplicate],0,0,1
'/questions/70936439/bulk-load-write-data-from-sql-server-to-azure-table-storage-using-ssis',Bulk load/write data from SQL server to Azure Table Storage using SSIS,0,0,1
'/questions/70936438/use-websocket-in-nest-js-and-angular',Use websocket in Nest js and Angular,0,0,1
'/questions/70936436/post-api-419-unknown-status-error-solution-in-react-js',POST (api) 419 (unknown status) error solution in REACT JS,0,0,1
'/questions/70936433/microsoft-sqlserver-type-version-11-0-0-0-is-existing-application-contains-but-n',microsoft.sqlserver.type Version=11.0.0.0 is existing application contains but need to upgrade it version=14.0.0.0 how to possible it,0,0,1
'/questions/70936430/how-to-get-the-file-manager-item-id-of-an-assignment-in-moodle-using-the-web-ser',How to get the file manager item id of an assignment in Moodle using the Web service API,0,0,1
'/questions/70936426/how-to-prevent-losing-line-items-inside-cart-when-using-apollo-nextjs-with-ssr',How To Prevent Losing Line Items Inside Cart When Using Apollo  Nextjs With SSR?,0,0,1
'/questions/70936425/swapping-two-values-in-python-dataframe-after-checking-a-condition',Swapping two values in python DataFrame after checking a condition [duplicate],0,0,1
'/questions/70936423/asp-net-core-background-service-stops-even-if-idle-timeout-is-0-and-start-mode',ASP .NET Core background service stops even if idle timeout is 0 and start mode is AlwaysRunning in iis,1,0,1
'/questions/70936422/native-script-webview-interface-plugin-unable-to-find-local-resource',native script: WebView Interface plugin unable to find local resource,0,0,1
'/questions/70936421/nomethoderror-in-tutorscontrollercreate-undefined-method-supert-for-tutor',NoMethodError in TutorsController#create undefined method `supert=' for #<Tutor:0x00007fa5593f99f8> Did you mean? super= super super super?,0,-1,1
'/questions/70936420/how-do-you-guys-start-your-personal-projects',How do you guys start your personal projects?,0,-1,1
'/questions/70936418/can-xcode-check-memory-leaks-like-valgrind-does-in-c-code-macos-monterey-12',Can Xcode check memory leaks like Valgrind Does in C++ code? (MacOS Monterey 12.1 M1),0,0,1
'/questions/70936416/using-continue-statement-in-javascript',Using continue Statement in JavaScript,0,0,1
'/questions/70936415/how-i-can-add-export-release-feature-in-redmine',How I can add 'export release' feature in Redmine,0,0,1
'/questions/70936413/why-the-prettier-code-formatter-stopped-formatting-the-code-in-vs-code',why the prettier code formatter stopped formatting the code in VS Code?,1,1,1
'/questions/70936411/filtering-using-having-by-clause-result-in-unknown-column-in-having-clause',filtering using having by clause result in unknown column in having clause,1,0,1
'/questions/70936410/kotlin-sam-interface-and-method-reference',Kotlin SAM interface and method reference,0,0,1
'/questions/70936409/kotlin-gradle-project',Kotlin Gradle Project,0,0,1
'/questions/70936408/how-to-calculate-percentage-of-each-class-variable-after-grouping-it-by-another',How to calculate percentage of each class variable after grouping it by another variable?,1,0,1
'/questions/70936407/unable-to-change-the-publicpath-in-vue-3-with-vite-js',Unable to change the publicPath in Vue 3 with Vite.js,1,0,1
'/questions/70936405/the-app-crashes-when-i-pick-image-from-gallery-the-second-time-have-tried-to-ca',The app crashes when i pick image from gallery the second time. Have tried to call System.gc() to clear the memory  but didn't worked,1,1,1
'/questions/70936403/creating-a-dynamic-chart-in-angular-using-the-data-in-json-file',Creating a dynamic chart in angular using the data in json file,0,0,1
'/questions/70936402/typescript-why-spread-is-not-safe',Typescript: why spread is not safe?,1,1,1
'/questions/70936401/store-all-response-of-request-module-in-database',Store all response of request module in database,0,0,1
'/questions/70936400/sql-server-raiseerror-throws-a-syntax-error',SQL Server: RaiseError throws a syntax error,1,0,1
'/questions/70936399/how-to-set-image-and-button-in-qr-code-scanner-screen',How to set Image and Button In qr Code scanner Screen?,0,0,1
'/questions/70936302/how-do-you-know-what-previous-control-is-in-cwinform',How do you know what previous control is in c#(winform)?,0,-1,1
'/questions/70936300/i-am-unable-to-install-packages-in-atom',I am unable to install packages in Atom,0,0,1
'/questions/70936299/ui-is-stuck-in-splash-screen-in-flutter',UI is stuck in splash Screen in flutter,1,1,1
'/questions/70936296/integer-sorting-with-js-by-taking-input-from-user',Integer Sorting with Js by taking input from user [duplicate],0,-1,1
'/questions/70936295/tesseract-is-not-installed-or-its-not-in-your-path-error-when-run-with-wsgi-a',"tesseract is not installed or it's not in your PATH" error when run with wsgi and nginx,0,-1,1
'/questions/70936294/c-space-or-t-at-the-end-of-printf-dont-show-up',C space or \t at the end of printf don't show up,0,0,1
'/questions/70936290/when-i-am-trying-to-access-files-from-remote-server-to-localhost-it-shows-some-e',When I am trying to access files from remote server to localhost it shows some error " Permission Denied" in ubuntu Linux,0,0,1
'/questions/70936289/how-to-use-javascript-code-for-slidertextinput-style',How to use Javascript code for sliderTextInput() style?,0,0,1
'/questions/70936286/unoconv-conversion-from-docx-to-pdf-not-working-asynchronously',unoconv conversion from docx to pdf not working asynchronously,0,0,1
'/questions/70936284/do-you-have-to-wait-for-firebase-hosting-to-process-files-before-theyre-avail',Do you have to wait for firebase hosting to "process" files before they're available?,0,0,1
'/questions/70936282/install-wkhtmltopdf-on-docker-golang-1-16-alpine',Install wkhtmltopdf on Docker Golang 1.16 alpine,0,0,1
'/questions/70936278/using-jsonpath-to-filter-json-message',using JsonPath to filter json message,0,0,1
'/questions/70936272/i-am-getting-missing-message-error-for-next-intl-npm-package-for-next-js-app',I am getting MISSING_MESSAGE error for next-intl npm package for next.js app,0,0,1
'/questions/70936271/how-do-i-pass-user-defined-build-settings-to-existing-bazel-rules',How do I pass user-defined build settings to existing Bazel rules?,0,0,1
'/questions/70936269/why-is-my-code-failing-to-compute-secret-key-in-diffie-hellman',Why is my code failing to compute secret key in diffie hellman?,0,0,1
'/questions/70936266/how-to-change-the-background-color-with-datatrigger-when-the-value-of-datagrid-c',How to change the background color with DataTrigger when the value of DataGrid changes?,0,2,1
'/questions/70936262/swiftui-pass-a-string-as-an-argument-in-a-function-called-in-a-different-view',SwiftUI Pass a String as an argument in a function called in a different view,0,0,1
'/questions/70936261/oauth-2-o-client-credential-work-flow-implementation',oAuth 2.O client credential work flow implementation,0,0,1
'/questions/70936260/missing-template-for-this-request-but-it-exists',Missing template for this request but it exists?,0,0,1
'/questions/70936256/reactnative-exception-in-native-guidedstepsupportfragment-call-android-leanbac',ReactNative: Exception in native GuidedStepSupportFragment call (Android LeanBack),0,0,1
'/questions/70936254/how-to-bulk-insert-5-5m-records-in-mongodb-through-django-model-with-in-small-ti',How to Bulk Insert 5.5M records in mongodb through django model with in small time?,0,0,1
'/questions/70936253/clustering-in-python-reduce-cluster-size',Clustering in python - reduce cluster size,0,0,1
'/questions/70936252/how-to-restrict-creating-android-folder-in-usb',How to restrict creating "Android Folder" in USB?,0,1,1
'/questions/70936249/if-ebpf-does-not-allow-global-variable-then-how-to-pick-incremental-keys',if ebpf does not allow global variable then how to pick incremental keys,0,0,1
'/questions/70936248/flutter-circle-avatar-with-progress-bar',Flutter - Circle Avatar with Progress Bar,1,0,1
'/questions/70936247/handling-rounding-issue-with-bignumber',Handling rounding issue with BigNumber,0,0,1
'/questions/70936246/what-is-the-type-of-custom-class-and-how-to-assign-its-type-to-an-functions-arg',What is the type of custom class and how to assign its type to an function's argument in python,0,0,1
'/questions/70936245/adding-3rd-party-apps-to-your-if-neededreact-native-project',Adding 3rd party apps to your ${if_needed&&'react native'} project,0,0,1
'/questions/70936244/web-scraping-from-google-play-store-with-flask',Web scraping from Google Play Store with Flask,0,0,1
'/questions/70936243/how-to-make-changes-in-project-json-file-in-flutter',How to make changes in project json file in flutter?,0,0,1
'/questions/70936241/expected-primary-expression-and-experimental-abi-encoder',Expected primary expression and Experimental ABI Encoder,0,0,1
'/questions/70936236/what-is-the-purpose-of-b-here',What is the purpose of `b` here?,0,0,1
'/questions/70936235/understanding-java-throws-exceptions',Understanding Java Throws/Exceptions,0,-2,1
'/questions/70936232/sudoku-solver-problem-with-js-implementation-after-rewriting-it-from-python',"Sudoku Solver" Problem with JS implementation after rewriting it from Python,0,-1,1
'/questions/70936231/php-8-1-fastcgi-exe-is-not-available-in-non-thread-safe-version',PHP 8.1 fastcgi exe is not available in non thread safe version,0,0,1
'/questions/70936230/which-loops-has-fastest-running-timeit-ends-the-earliest-when-b-2',Which loop(s) has fastest running time(It ends the earliest)  when b = 2?,0,0,1
'/questions/70936226/how-to-keep-json-server-alive-permanently',How to keep json-server alive permanently?,0,0,1
'/questions/70936224/ffmpeg-add-subtitles-to-live-stream-dynamically',FFmpeg: add subtitles to live stream dynamically,0,0,1
'/questions/70936223/how-to-close-editable-ag-grid-dropdown-on-select',How to close editable ag-grid dropdown on select?,0,0,1
'/questions/70936220/java-oops-with-access-modifier',Java OOPS with Access modifier [closed],0,-6,1
'/questions/70936219/how-to-display-json-vertically-as-columns-not-horizontally-as-rows',how to display json vertically (as columns) not horizontally (as rows),0,0,1
'/questions/70936218/pyqt5-qtablewidget-gui-update-is-too-slow-when-there-are-many-cells',PyQt5 QTableWidget GUI update is too slow when there are many cells,0,0,1
'/questions/70936213/bad-answer-using-two-set-single-number-leetcode-136',bad answer using two set. Single number leetcode-136 [closed],0,-4,1
'/questions/70936212/not-able-to-understand-the-use-of-jwt-clearly',Not able to understand the use of JWT clearly [closed],0,-2,1
'/questions/70936211/getting-redirected-from-keycloak-login-page-and-strange-behaviour-is-noticed',Getting redirected from keycloak login page and strange behaviour is noticed,0,0,1
'/questions/70936210/call-a-function-of-purchasemodel-in-to-another-model-name-salesmodel-without-loa',Call a function of PurchaseModel in to another model name SalesModel without loading PurchaseModel into SalesModel,0,0,1
'/questions/70936209/how-to-integrate-a-c-program-runnable-terminal-to-an-online-coding-environment',How to integrate a C program runnable terminal to an online coding environment?,2,0,1
'/questions/70936208/wanna-ask-about-breaking-the-loop-in-a-defined-function',Wanna ask about breaking the loop in a defined function?,1,-1,1
'/questions/70936207/i-want-to-change-my-application-integration-text-with-evernote',I want to change my application integration text with Evernote,0,0,1
'/questions/70936206/i-want-build-a-classification-model-with-the-labels-of-the-clusters-as-my-target',I want build a classification model with the labels of the clusters as my target variable that predicts the cluster of new text data when input enter,0,0,1
'/questions/70936599/nested-select-menu-in-angular',Nested select menu in angular,0,0,1
'/questions/70936598/i-have-vps-server-how-hide-my-main-ip-or-can-i-add-multiple-ips-to-that-vps',I have VPS Server how hide my main ip or can i add multiple ips to that VPS,0,0,1
'/questions/70936597/how-to-get-x-y-coordination-after-release-the-click-move-the-mouse-at-same-tim',How to get X Y coordination after release the Click + Move the mouse at same time - VueJs,0,0,1
'/questions/70936595/how-to-use-complete-cases-in-gtsummary-for-each-variable-for-doing-a-paired-t-te',How to use complete.cases in gtsummary for each variable for doing a paired t.test instead doing complete.cases for full data frame?,1,0,1
'/questions/70936594/django-form-with-dependent-foreignkey-forms-on-one-page',Django Form with dependent ForeignKey forms on one Page,0,0,1
'/questions/70936593/migrating-mvc-5-project-to-angular-10',Migrating MVC 5 Project to Angular 10,0,1,1
'/questions/70936589/cognito-user-sign-up-stuck-in-unconfirmed-state-resend-confirmation-link-not-wo',Cognito user sign-up stuck in UNCONFIRMED state (resend confirmation link not working),0,0,1
'/questions/70936585/how-to-forward-a-tsdoc-description-within-an-object-property',How to forward a TSDoc description within an object property,0,1,1
'/questions/70936584/run-angularjs-application-fails',run Angularjs application fails,0,0,1
'/questions/70936582/google-tag-manager-not-showing-any-existing-tags',Google tag manager not showing any existing tags,0,0,1
'/questions/70936581/how-to-prevent-deleting-image-in-contenteditable',How to prevent deleting image in ContentEditable,0,0,1
'/questions/70936580/how-can-i-restrict-someone-from-entering-numbers-or-special-characters-in-my-nam',How can I restrict someone from entering numbers or special characters in my NAME edittext,1,0,1
'/questions/70936577/gcs-integration-using-play-wsclient-not-working',GCS integration using play wsclient not working,0,0,1
'/questions/70936575/assertionerror-expected8089-but-was-1',AssertionError: expected:<8089> but was:<-1>,0,0,1
'/questions/70936573/how-to-prevent-scaling-of-background-image-using-css',How to prevent scaling of background image using CSS?,1,0,1
'/questions/70936571/auth0-sdk-not-passing-code-verifier',Auth0 SDK Not Passing code_verifier,0,0,1
'/questions/70936568/how-i-round-off-two-decimal-point-in-java',How i round off two decimal point in java?,0,-1,1
'/questions/70936567/need-to-sync-database-to-salesforce-where-database-refreshing-everyday',Need to sync database to salesforce where database refreshing everyday,0,0,1
'/questions/70936563/model-dont-get-objects-in-clean-fieldname-functions',Model don't get objects in clean_<fieldname> functions,0,0,1
'/questions/70936562/how-to-write-this-in-c-language',How to write this in C language [closed],0,-5,1
'/questions/70936559/getting-this-error-since-long-time-site-didnt-send-anydata',Getting this error since long time "Site didn't send anydata",0,-2,1
'/questions/70936558/set-up-reverse-proxy-for-node-js-using-nginx-on-different-location',Set up reverse proxy for node.js using nginx on different location,0,0,1
'/questions/70936554/quiz-questions-dont-appear-unless-function-run-in-console',Quiz questions don't appear unless function run in console,1,0,1
'/questions/70936550/how-do-i-get-the-query-which-executed-more-time-from-a-log-file',how do i get the query which executed more time from a log file,0,0,1
'/questions/70936548/firebase-cloud-messaging-on-ios-applicationdidregisterforremotenotificationsw',Firebase Cloud Messaging on iOS: 'application:didRegisterForRemoteNotificationsWithDeviceToken' must be present  but is never called,0,0,1
'/questions/70936542/is-it-guaranteed-that-the-term-version-appears-in-the-output-of-java-version',Is it guaranteed that the term "version" appears in the output of `java -version`?,1,0,1
'/questions/70936539/set-footer-text-to-all-embeds-discord-js',Set footer text to ALL embeds (Discord.JS),0,0,1
'/questions/70936538/caddyfile-how-to-run-multiple-listeners-under-the-same-server',Caddyfile - How to run multiple listeners under the same server?,0,0,1
'/questions/70936535/unable-to-fetch-post-request-in-azure-devops-agentless-invoke-rest-api',Unable to fetch POST request in Azure devops Agentless invoke REST API,0,0,1
'/questions/70936534/bump-python-package-version-upon-main-branch-merge',Bump Python package version upon main branch merge,0,0,1
'/questions/70936533/i-was-given-to-implement-this-function-name-operator-name-const-using-ope',I was given to implement this function: name operator + (name const &) using operator+() in below program,1,1,1
'/questions/70936525/assignmentmavens-for-writing-technical-specification',AssignmentMavens - For Writing Technical Specification,0,-1,1
'/questions/70936524/value-being-constant-in-swiftui',value being constant in swiftUI,0,0,1
'/questions/70936521/fetch-last-available-value-if-there-is-null',Fetch last available value if there is NULL,0,0,1
'/questions/70936518/how-can-you-mock-a-static-methode-using-wrapper',How can you Mock a static methode using wrapper?,0,0,1
'/questions/70936517/pandas-conditional-filter-on-same-column',Pandas Conditional filter on same column,1,0,1
'/questions/70936516/how-to-kill-thread-in-net5-6',How to kill thread in .NET5/6,2,0,1
'/questions/70936512/mobile-application-architecture-difference-between-high-load-and-simple-systems',Mobile application architecture: Difference between high-load and simple systems?,0,1,1
'/questions/70936509/react-how-to-setstate-in-child-component-from-parent-component',React: How to setState in child component from parent component?,3,0,1
'/questions/70936508/i-have-to-get-a-dependend-dropdown-while-using-the-api-i-cant-get-it-can-any-one',i have to get a dependend dropdown while using the api i cant get it can any one clear it.i am getting a error while i am trying,0,0,1
'/questions/70936507/modify-output-path-in-webpack-neutrino-csssyntaxerror-unknown-word',modify output path in webpack/ neutrino CssSyntaxError Unknown Word,0,0,1
'/questions/70936506/book-clone-one-navigation-controller-bar-and-items-in-multiple-view-controllers',Book clone: One navigation controller bar and items in multiple view controllers and passing objects using Notification center,0,0,1
'/questions/70936503/make-mui-collapse-component-take-up-view-width',Make MUI Collapse Component take up view width,0,0,1
'/questions/70936500/layout-fix-sidebar-and-header-antd',Layout fix sidebar and header Antd,0,0,1
'/questions/70936499/how-to-use-infopopupview-to-implement-popup-on-a-row-of-a-datagrid-using-xaml',How to use InfoPopupView to implement popup on a row of a Datagrid using xaml?,0,1,1
'/questions/70936496/how-to-add-secondary-vertical-axis-to-the-same-barchart-in-rdlc-report',How to add secondary vertical axis to the same barchart in rdlc report,0,-1,1
'/questions/70936494/how-to-create-sub-dropdown-menu-in-flutter-drawer',how to create sub dropdown menu in flutter drawer,1,0,1
'/questions/70936488/mysql-database-integration',Mysql database integration,0,0,1
'/questions/70936486/getting-websockets-in-spring-to-work-with-postman-for-testing',Getting Websockets in Spring to work with PostMan for testing,0,0,1
'/questions/70936484/trying-to-store-values-and-loop-calculations-from-a-function',Trying to store values and loop calculations from a function,2,0,1
'/questions/70936396/get-all-students-who-has-got-more-marks-than-the-average-marks-of-that-class',get all students who has got more marks than the average marks of that class,2,0,1
'/questions/70936394/wordpress-read-qr-code-data-and-save-them-to-database',Wordpress Read QR code data and save them to database,0,-1,1
'/questions/70936392/how-to-debug-or-possibly-simply-compile-asp-net-from-only-command-line',How to debug or possibly simply Compile Asp.NET from only command line,0,0,1
'/questions/70936388/cat-with-multiquery-is-not-working-when-creating-and-inserting-data-into-tempo',Cat with --multiquery is not working when creating and inserting data into Temporary table clickhouse,0,0,1
'/questions/70936387/how-to-export-unnamed-portal-1-to-csv-file-in-postgresql-function-output',How to export "<unnamed portal 1> to csv file in postgresql - function output,0,0,1
'/questions/70936386/position-relative-or-absolute-and-text-align-left',Position relative or absolute and text align left,1,0,1
'/questions/70936385/in-reference-to-an-object-color-height-weight-and-name-are-all-examples',In reference to an object  color, height, weight and name are all examples [closed],0,-3,1
'/questions/70936384/when-ever-i-open-terminal-in-visual-studio-code-the-terminal-is-blank-and-cant-t',when ever i open terminal in visual studio code the terminal is blank and cant type a single word in it,1,0,1
'/questions/70936382/odoo13-ce-module-sale-order-what-inherit-id-do-i-need-to-inherit-quotation-tr',Odoo13-CE: Module: sale.order: What inherit_id do I need to inherit quotation tree/list view?,0,0,1
'/questions/70936378/circleci-build-fails-when-setting-up-add-ssh-keys-config',CircleCI build fails when setting up add_ssh_keys config,1,0,1
'/questions/70936377/how-to-expose-objective-c-header-file-to-swift-in-swift-static-library',how to expose Objective C header file to swift in swift static library?,0,0,1
'/questions/70936371/why-ckeditor-content-stored-in-database-do-not-display-as-html-in-php',why ckeditor content stored in database do not display as html in php,2,1,1
'/questions/70936370/how-to-add-a-additional-dense-layer-im-getting-value-error',how to add a additional dense layer i'm getting value error,0,0,1
'/questions/70936366/token-management-in-karate-parallel-execution',Token management in Karate parallel execution,0,0,1
'/questions/70936365/why-isnt-the-sequencer-repeating-the-autopage',Why isn't the sequencer repeating the AutoPage?,1,0,1
'/questions/70936364/error-in-publish-blazor-wams-version-net5-after-install-visual-studio-2022',error in publish blazor-wams version.net5 after install visual studio 2022,0,0,1
'/questions/70936363/add-product-to-cart-with-price-override',Add product to cart with price override?,0,0,1
'/questions/70936362/swift-javascriptcore-call-function-return-undefined-but-python-execjs-return-cor',Swift JavaScriptCore call function return undefined but Python execjs return correct result,0,0,1
'/questions/70936357/how-to-check-two-excels-in-a-validation',How to check two excels in a validation?,1,0,1
'/questions/70936356/escaped-characters-are-not-working-in-kotlin',Escaped characters are not working in Kotlin,0,0,1
