Question Link, Question,Answer Count,Upvotes,Count
'/questions/70930134/wso2-api-manager-dockerfile-userid-number-for-kubernetes-openshift',WSO2 API Manager Dockerfile userid number for Kubernetes/Openshift,1,0,1
'/questions/70930131/pi-estimator-in-r',Pi Estimator in R,3,1,1
'/questions/70930129/how-to-stop-the-browser-from-asking-the-user-to-open-with-option-and-force-the-l',how to stop the browser from asking the user to open with option and force the link to open in the default browser with javascript?,0,-3,1
'/questions/70930127/nltk-available-languages-for-word-tokenization-and-sentence-tokenization',NLTK available languages for word tokenization and sentence tokenization,0,0,1
'/questions/70930126/integer-division-by-zero-but-system-shows-execution-with-exit-code-0',Integer division by zero but system shows execution with exit code 0,1,-2,1
'/questions/70930125/how-to-provide-a-git-clone-with-a-username',How to provide a `git clone` with a username,0,1,1
'/questions/70930124/graphql-best-practice-when-processing-queries-with-multiple-data',GraphQL best practice when processing queries with multiple data,0,0,1
'/questions/70930123/how-do-i-use-send-keys-whe-a-mistake-appear-s',how do i use send_keys whe a mistake appear s?,0,0,1
'/questions/70930122/country-specific-user-class-ids',country-specific user Class IDs,0,0,1
'/questions/70930118/copy-into-table-in-snowflake-throws-table-does-not-exist',COPY INTO <table> in snowflake throws table does not exist,4,2,1
'/questions/70930117/xamarin-forms-community-toolkit-popup-working-in-ios-not-android',Xamarin.Forms - Community Toolkit Popup working in iOS not Android,1,-1,1
'/questions/70930116/trying-to-read-a-json-file-with-a-js-script-in-html',Trying to read a JSON file with a JS script in HTML,1,0,1
'/questions/70930114/issue-in-using-socket-io-in-express-router',issue in using Socket.io in Express Router,0,0,1
'/questions/70930113/fast-way-to-categorize-a-list',Fast way to categorize a list,0,-1,1
'/questions/70930109/return-collection-of-one-without-trying-to-get-property-of-non-object-error',Return collection of one without "Trying to get property of non-object" error,1,0,1
'/questions/70930107/mvc-precompiled-site-http-error-403-14-forbidden-suddenly-appeared-after-11',MVC precompiled site "HTTP Error 403.14 - Forbidden" suddenly appeared after 11 months,0,0,1
'/questions/70930106/read-cosmosdb-items-from-pyspark-databricks-with-an-inconsistent-model',Read CosmosDb items from pyspark (Databricks) with an inconsistent model,0,0,1
'/questions/70930105/asp-net-core-server-side-unobtrusive-ajax-and-model-validation',ASP.NET Core server side Unobtrusive Ajax and model validation,0,0,1
'/questions/70930104/typescript-testing-access-to-static-assets',TypeScript testing -- access to static assets?,0,0,1
'/questions/70930099/react-nativefcm-notifications-are-not-coming-in-closed-killed-app',React native:Fcm Notifications are not coming in closed / killed app,0,0,1
'/questions/70930098/strapi-issue-user-content-type-does-not-accept-component',Strapi issue user content-type does not accept component,0,0,1
'/questions/70930097/what-is-the-best-tool-or-widget-to-create-an-image-editor-that-can-stack-indeter',What is the best tool or widget to create an image editor that can stack indeterminate amount of images  move them around and distribute by layers?,0,0,1
'/questions/70930095/what-are-the-characters-without-which-you-cant-run-scripts-in-html',What are the characters without which you can't run scripts in HTML? [closed],0,-2,1
'/questions/70930093/sql-query-to-find-deltas-between-multiple-series-in-time-series-data',SQL query to find deltas between multiple series in time-series data,1,0,1
'/questions/70930090/turning-two-streams-into-a-single-stream-to-pipe-with-read-and-write-streams',Turning two streams into a single stream to pipe with read and write streams,0,0,1
'/questions/70930089/to-get-all-the-two-letters-directories-using-terminal',To get all the two letters directories using terminal,1,2,1
'/questions/70930087/angular-navigation-from-within-capacitor-listener-not-working',Angular navigation from within Capacitor listener not working,0,-1,1
'/questions/70930086/looking-for-values-from-another-table-where-they-do-not-exist-in-a-given-group',looking for values from another table where they do not exist in a given group,1,1,1
'/questions/70930083/how-to-disable-fields-in-adobe-through-javascript',How to disable fields in Adobe through javascript?,0,-2,1
'/questions/70930082/condtitions-in-void-functions',Condtitions in void functions,3,0,1
'/questions/70930081/spring-jpa-query-not-get-parameters',Spring JPA query not get parameters,0,0,1
'/questions/70930080/jenkins-pipeline-conditional-stages-based-on-the-changeset',Jenkins Pipeline Conditional Stages based on the Changeset,1,0,1
'/questions/70930077/verify-ecdsa-signature-using-c-sharp-adoc-archive',Verify ECDsa signature using c# (.adoc archive),0,0,1
'/questions/70930074/sql-server-login-auditing-performance-impact',SQL Server Login Auditing -- Performance Impact,0,0,1
'/questions/70930073/tensorflow-2-partially-restore-checkpoint',Tensorflow 2 partially restore checkpoint,0,0,1
'/questions/70930072/using-utf-8-string-literal-prefixes-portably-between-c17-and-c20',Using UTF-8 string-literal prefixes portably between C++17 and C++20,1,4,1
'/questions/70930071/npm-install-force-to-not-use-binary-cache-and-rebuild-from-source-skip-prebuild',npm install force to not use binary cache and rebuild from source  skip prebuild-install,0,0,1
'/questions/70930070/how-to-use-djangos-full-clean-using-a-non-default-database',How to use Django's `full_clean` using a non-default database,0,0,1
'/questions/70930069/swiftui-focusstate-on-parant-and-child-view-causes-dismisses-of-child-view',SwiftUI FocusState on Parant and Child view causes dismisses of child view,0,0,1
'/questions/70930067/creating-a-mysql-query-from-results-of-splitting-a-string-and-using-like-to-matc',Creating a MYSQL query from results of splitting a string and using LIKE to match keywords in PHP,1,0,1
'/questions/70930066/react-native-app-with-google-maps-places-api-integration-for-an-autocomplete-sea',React Native app with google maps places API integration for an autocomplete search input,0,0,1
'/questions/70930065/why-i-couldnt-establish-connection-between-mongodb-and-nodjs-app-in-heroku',why i couldn't establish connection between mongodb and nodjs app in heroku?,0,0,1
'/questions/70930062/add-a-button-that-opens-a-popup-inside-my-django-model-form',Add a "+" button that opens a popup inside my django model form,1,0,1
'/questions/70930059/proper-way-of-getting-address-of-sys-call-table',Proper way of getting address of sys_call_table,1,0,1
'/questions/70930056/i-want-to-import-3d-gltf-model-via-htmls-input-tag-for-file-in-three-js-javasc',I want to import 3d gltf model via html's input tag for file in three.js (javascript) but it's giving me an error,1,0,1
'/questions/70930051/export-of-jira-issues-and-dashboards-for-exec-presentations',Export of JIRA issues and dashboards for exec presentations,1,0,1
'/questions/70930050/create-custom-versions-in-multisite-wordpress',Create custom versions in multisite WordPress,0,0,1
'/questions/70930048/how-to-webscrape-a-text-inside-a-link-in-python',How to webscrape a text inside a link in Python?,3,0,1
'/questions/70930047/deploy-a-spring-boot-application-which-uses-activemq-from-docker-to-heroku',Deploy a Spring Boot application which uses ActiveMQ from Docker to Heroku,0,0,1
'/questions/70930046/babel-parse-error-in-eks-not-present-when-built-locally',Babel Parse Error in EKS not Present when Built Locally,0,0,1
'/questions/70930043/geocode-issue-with-asynchronicity-in-javascript-google-maps-api',Geocode issue with asynchronicity in javascript Google Maps API [duplicate],0,-3,1
'/questions/70930042/best-way-to-count-the-number-of-occurrences-of-a-substring',Best way to count the number of occurrences of a substring? [duplicate],2,-1,1
'/questions/70930038/postgresql-recursive-category-tree-where-are-the-children-in-the-top-parents-ar',postgresql recursive category tree where are the children in the top parent's array,1,0,1
'/questions/70930037/why-does-a-white-border-in-a-card-view-appears-when-load-an-image',Why does a white border in a card view appears when load an image?,1,0,1
'/questions/70930036/parsing-graphql-introspection-request-for-querynames',Parsing GraphQL Introspection Request for QueryNames,0,0,1
'/questions/70930035/how-can-i-map-a-wsl-type-unc-path-to-a-windows-drive-letter',How can I map a \\wsl$\ type unc path to a windows drive letter?,0,0,1
'/questions/70930033/save-the-final-value-of-a-linked-list-to-a-variable-in-java',Save the final value of a linked list to a variable in Java,4,0,1
'/questions/70930031/vagrant-multiple-vm-provision-order',Vagrant Multiple VM Provision Order,0,0,1
'/questions/70930030/needing-to-mock-a-closed-source-web-application-sailpoint-best-way-to-dump-obj',Needing to mock a closed source web application (sailpoint) best way to dump objects not marked as serializable in this case?,0,0,1
'/questions/70930025/how-do-i-run-a-script-using-a-different-oauth-token-when-using-a-python-script-f',How do I run a script using a different Oauth Token when using a python script for Gspread?,1,0,1
'/questions/70930023/mongoose-aggregate-query-to-filter-value-from-the-ref-collection',Mongoose aggregate query to filter value from the ref collection,2,0,1
'/questions/70930019/build-system-ctas-callback-function-not-working',Build System CTA's/Callback function not working,0,0,1
'/questions/70930017/spark-streaming-taking-more-time-to-execute-one-batch',spark streaming taking more time to execute one batch,0,0,1
'/questions/70930016/quarkus-grpc-integration-tests',Quarkus gRPC integration tests,0,0,1
'/questions/70930015/custom-does-not-exist-error-message-for-onetoonefield-field-in-django-model-not',custom does_not_exist error_message for OneToOneField field in Django model not working,0,0,1
'/questions/70930014/make-div-within-a-link-display-inline-with-bootstrap-4',Make div within a link display inline with bootstrap 4?,2,0,1
'/questions/70930012/hoshen-kopelman-algorithm-matlab-implementation',Hoshen-Kopelman Algorithm MatLab Implementation,0,0,1
'/questions/70930010/changing-boolean-value-in-an-array-based-on-checking-the-flag',Changing Boolean value in an array based on checking the flag [duplicate],0,-1,1
'/questions/70930009/xmlhttprequest-not-working-on-browsers-on-ios',XMLHttpRequest not working on browsers on iOS,0,0,1
'/questions/70930006/why-do-the-quantity-up-and-down-arrows-only-show-on-some-of-the-product-pages-an',Why do the Quantity Up and Down arrows only show on some of the product pages and not others on BigCommerce's Cornerstone Light theme?,1,0,1
'/questions/70930004/range-optimizations-opportunities',Range optimizations opportunities [duplicate],0,3,1
'/questions/70930002/how-to-stop-firing-tealium-tag-multiple-time-on-same-page',How to stop firing tealium tag multiple time on same page,0,0,1
'/questions/70930001/value-of-type-viewcontroller-has-no-member',Value of type "ViewController" has no member [closed],1,-3,1
'/questions/70930000/return-json-object-with-a-header',Return JSON object with a "header",2,0,1
'/questions/70929998/how-exactly-do-espresso-ui-tests-increase-code-coverage',How exactly do Espresso UI tests increase code coverage?,0,0,1
'/questions/70929996/visual-studio-2022-cant-find-nuget-package',Visual Studio 2022 can't find nuget package,0,0,1
'/questions/70929990/visual-studio-0xc00007b-vcpkg-dll-libs',Visual studio 0xc00007b vcpkg dll libs,0,0,1
'/questions/70929989/where-are-gnu-makes-implicit-rules-defined-how-can-i-change-them-on-macos',Where are GNU Make's implicit rules defined? How can I change them on macOS?,0,0,1
'/questions/70929988/compiler-refuses-to-compile-after-i-retarget-a-net-6-project-to-net-framework',Compiler refuses to compile after I retarget a .NET 6 project to .NET Framework 4.8,0,0,1
'/questions/70929986/how-to-check-if-username-already-exists-in-firebase-realtime-database',How to check if username already exists in firebase Realtime Database,1,1,1
'/questions/70929985/more-efficient-way-to-replace-special-chars-with-their-unicode-name-in-pandas-df',More efficient way to replace special chars with their unicode name in pandas df,1,0,1
'/questions/70929984/php-how-to-read-exact-information-from-xml-string',PHP - How to read exact information from XML string?,1,0,1
'/questions/70929983/how-to-make-a-gif-in-the-js-function',How to make a gif in the js function? [closed],0,-3,1
'/questions/70929979/extract-string-in-between-string-java-using-regex',Extract String in between String Java Using Regex [closed],0,-3,1
'/questions/70929978/alchemy-web3-web3js-error-importing-smart-contract-abi',Alchemy Web3 (Web3js) - Error importing smart contract ABI,0,0,1
'/questions/70929976/doubling-active-x-elements-during-presentation',Doubling active x elements during presentation,0,0,1
'/questions/70929975/how-to-show-separate-data-for-each-bootstrap-modal-using-angular',How to show separate data for each bootstrap modal using angular,1,0,1
'/questions/70929971/libgdx-firebase-crash-caused-by-java-util-emptystackexception',libgdx Firebase crash: Caused by java.util.EmptyStackException,0,0,1
'/questions/70929970/vscode-showinformationmessage-how-to-add-a-header-to-message',vscode.showInformationMessage - how to add a header to message,0,0,1
'/questions/70929966/react-native-navigation-render-a-screen-inside-another-screen',React Native Navigation - Render a screen inside another screen,1,-1,1
'/questions/70929964/php-double-data-faker-with-primary-key',PHP double data faker with primary key,0,-1,1
'/questions/70929961/bpf-sdk-path-does-not-exist',BPF SDK path does not exist,0,0,1
'/questions/70929960/displaying-the-loading-state-in-fragment-with-android-paging-3-java',Displaying the loading state in Fragment with Android paging 3 java,0,0,1
'/questions/70929959/implement-toolbar-buttons-in-one-activity',implement toolbar buttons in one activity,1,0,1
'/questions/70929957/whenever-i-try-to-initialize-schema-in-next-js-it-shows-error',Whenever I try to initialize schema in next.js it shows error,2,-1,1
'/questions/70929955/how-to-read-my-keyboard-input-in-visual-basic',How to read my keyboard input in Visual Basic,0,0,1
'/questions/70929954/reading-a-pgm-file-and-writing-it-in-csv-form-in-r',reading a .pgm file and writing it in .csv form in R,0,-1,1
'/questions/70929949/on-mac-m1-machine-not-able-to-run-ef-core-migrations-add-update-in-asp-net-co',On Mac M1 machine - Not able to run EF core Migrations Add  Update in Asp.Net Core 3.1,0,-1,1
'/questions/70929948/choose-positions-in-the-pivot-table',Choose positions in the pivot table,0,0,1
'/questions/70929943/script-no-longer-works-after-pytoexe-conversion',Script no longer works after pytoexe conversion,0,0,1
'/questions/70929942/react-useeffect-enforce-execution-order',React - UseEffect enforce execution order,0,0,1
'/questions/70929936/creating-a-staging-table-and-turning-it-into-a-normalized-database',Creating a staging table and turning it into a normalized database [duplicate],0,-1,1
'/questions/70929935/next-js-cors-error-post-method-to-another-domain',Next.js CORS error POST method to another domain,0,-1,1
'/questions/70929932/whats-the-most-efficient-way-of-displaying-and-saving-an-mxn-checkerboard-pix',What's the most efficient way of displaying *and* saving an MxN checkerboard pixel grid?,0,-1,1
'/questions/70929927/ms-sql-iterate-a-subquery',MS SQL: iterate a subquery [duplicate],0,0,1
'/questions/70929925/how-to-tell-part-of-my-image-was-shifted',How to tell part of my image was shifted?,0,0,1
'/questions/70929921/github-action-docker-image-of-asp-net-core-application',Github Action Docker Image of ASP.net Core application,0,0,1
'/questions/70929919/how-do-i-test-whether-a-given-sql-syntax-is-valid-for-an-older-version-of-sql-se',How do I test whether a given SQL Syntax is valid for an older version of SQL Server,0,1,1
'/questions/70929915/google-maps-fitbounds-not-centering-and-showing-markers-in-google-maps-react',Google Maps fitBounds not centering and showing markers in google-maps-react,1,0,1
'/questions/70929914/api-integration-in-cordova-app-find-specific-data-in-a-list',API integration in Cordova APP- Find Specific Data in a list,0,0,1
'/questions/70929912/calling-virtually-overloaded-function-from-child-class',Calling virtually overloaded function from child class,0,0,1
'/questions/70929910/is-it-possible-to-have-cloudwatch-alarm-use-metric-math-to-alarm-if-a-fraction-o',Is it possible to have CloudWatch alarm use metric math to alarm if a fraction of the metrics are over a threshold?,0,0,1
'/questions/70929909/react-native-moment-js-find-sum-of-elements-which-fall-in-a-date-range-otherwise',React Native moment.js find sum of elements which fall in a date range otherwise return 0,0,0,1
'/questions/70929908/user-password-getting-hashed-twice',User password getting hashed twice?,0,0,1
'/questions/70929907/convert-base64-string-to-excel-file',Convert base64 string to excel file,0,0,1
'/questions/70929905/react-i18next-change-language-does-not-re-render-components-that-are-memoized',React i18next - Change language does not re-render components that are memoized using React.memo,0,0,1
'/questions/70929903/how-to-prevent-helm-from-renaming-the-resource-that-uses-hooks',How to prevent Helm from renaming the resource that uses hooks?,0,0,1
'/questions/70929894/binance-apit-error-signature-for-this-request-is-not-valid',Binance apit error: Signature for this request is not valid,0,0,1
'/questions/70929889/do-i-need-layout-activity-main-in-react-native-app-android-for-admob',Do I need layout/activity_main in react native app (android) for admob?,1,0,1
'/questions/70929887/make-nodemon-use-old-version-on-crash',Make Nodemon use old version on crash,0,0,1
'/questions/70929886/flutter-injectable-inject-one-singleton-for-several-interfaces',Flutter injectable - Inject one singleton for several interfaces,0,0,1
'/questions/70929882/not-sure-why-im-receiving-no-such-file-or-directory',Not sure why I'm receiving " No such file or directory" [closed],0,-4,1
'/questions/70929880/media-queries-stop-working-after-copying-css-code-into-scss',Media queries stop working after copying CSS code into SCSS,0,0,1
'/questions/70929879/symfony-api-platform-secure-delete-a-ressource',Symfony api platform : secure delete a ressource,0,-2,1
'/questions/70929878/primeng-p-calendar-month-picker-not-working',PrimeNG p-calendar month picker not working,1,0,1
'/questions/70929876/can-i-download-an-hls-video-from-a-protected-player-if-i-have-the-m3u8-url-and-a',Can I download an hls video from a protected player if I have the m3u8 url and all the .ts files?,0,-1,1
'/questions/70929874/animated-gif-looping-more-than-once-after-uploading-to-wordpress',Animated gif looping more than once after uploading to WordPress,0,0,1
'/questions/70929873/ansible-ternary-operator-syntax',Ansible Ternary Operator syntax [closed],0,0,1
'/questions/70929870/how-to-plot-results-of-soil-horizon-analysis-horizontally',How to plot results of soil horizon analysis horizontally?,1,0,1
'/questions/70929868/how-to-load-balance-containers-using-nginx',How to Load balance containers using nginx,0,0,1
'/questions/70929867/recognize-a-four-character-combination-and-identify-where-to-put-them',Recognize a four character combination and identify where to put them,1,0,1
'/questions/70929863/glue-spark-write-data-one-partition-at-time',Glue Spark write data one partition at time,1,0,1
'/questions/70929861/implementing-students-t-distribution-in-dcc-garch',Implementing Student's t distribution in DCC-GARCH,0,0,1
'/questions/70929859/how-to-delete-my-logo-in-the-header-on-wordpress',How to delete my logo in the header on wordpress?,0,-1,1
'/questions/70929855/attendance-clock-in-and-out-over-midnight-diffrence',Attendance clock in and out over midnight diffrence,0,1,1
'/questions/70929854/problem-updating-eclipse-rcp-application-from-4-16-to-4-22',Problem updating eclipse rcp application from 4.16 to 4.22,0,0,1
'/questions/70929851/is-there-a-way-to-expose-dbeavers-ssh-tunnels-local-port',Is there a way to expose DBeaver's ssh tunnel's local port?,0,0,1
'/questions/70929850/best-practice-data-storage-to-avoid-too-many-queries',Best practice data storage to avoid too many queries [duplicate],0,0,1
'/questions/70929849/why-does-rubys-io-readlines-method-behave-differently-when-followed-by-a-filter',Why does ruby's IO readlines method behave differently when followed by a filter,1,0,1
'/questions/70929848/falco-k8s-pod-name-na',Falco - K8s pod name <na> [closed],0,-1,1
'/questions/70929847/why-is-a-variable-undefined-in-a-statement-immediately-following-the-variables',Why is a variable undefined in a statement immediately following the variable's instantiation? [closed],0,-3,1
'/questions/70929845/how-to-read-a-nested-list-from-a-file',How to read a nested list from a file?,1,0,1
'/questions/70929842/is-ufw-allow-proto-tcp-to-any-port-equivalent-to-ufw-allow-tcp',Is `ufw allow proto tcp to any port [...]` equivalent to `ufw allow [...]/tcp`?,0,0,1
'/questions/70929840/labeling-side-by-side-boxplots',Labeling Side-By-Side Boxplots,1,2,1
'/questions/70929839/which-file-should-i-put-android-configure-for-auth0-in-react-native',Which file should I put android configure for auth0 in react-native,0,0,1
'/questions/70929838/i-tried-one-function-and-im-getting-this-error-typeerror-not-supported-b',i tried one function and i'm getting this error - TypeError: '<' not supported between instances of 'tuple' and 'int',0,0,1
'/questions/70929837/how-can-i-whitelist-my-ip-address-on-spam-haus-and-spam-rats-class-c',How can i whitelist my IP address on spam haus and spam rats (class C),0,0,1
'/questions/70929836/outofmemory-exception-raised-in-okhttp-onfailure-callback',OutOfMemory Exception raised in okHttp onFailure callback,0,0,1
'/questions/70929833/unable-to-remove-escape-character-from-my-xml-string',Unable to remove escape character from my XML string,0,0,1
'/questions/70929831/get-1-or-0-if-another-table-value-is-bigger-than-5',Get 1 or 0 IF another table value is bigger than 5,1,-1,1
'/questions/70929832/typescript-interface-constants-vs-class-for-defining-enum-like-object',Typescript interface + constants vs class for defining enum-like object,0,1,1
'/questions/70929830/cannot-start-service-in-windows-docker-container',Cannot start service in windows-docker-container,0,0,1
'/questions/70929829/how-to-bind-select2-from-kartik-to-v-model',How to bind Select2 from kartik to v-model?,0,0,1
'/questions/70929828/net-5-asp-net-core-razor-application-electron-net',.Net 5 Asp.net core razor application Electron.NET,0,0,1
'/questions/70929825/can-anyonr-please-help-coding-in-java',can anyonr please help coding in java [closed],0,-8,1
'/questions/70929823/why-does-tensorflow-produce-a-warning-when-reading-weights-from-a-temporary-file',Why does tensorflow produce a warning when reading weights from a temporary file?,0,0,1
'/questions/70929822/reading-the-file-with-formatting-in-r',Reading the file with formatting in R,0,0,1
'/questions/70929819/can-const-data-members-have-different-values-between-translation-units',Can const data members have different values between translation units?,3,1,1
'/questions/70929817/how-do-i-query-using-t-sql',How do I query using T-SQL [duplicate],0,-2,1
'/questions/70929815/given-a-flow-network-and-a-max-flow-f-on-it-determine-whether-there-are-at-leas',Given a flow network and a max flow f on it  Determine whether there are at least 4 different max flows,0,0,1
'/questions/70929812/mongodb-disable-javascript-execution',MongoDB disable Javascript execution,0,-2,1
'/questions/70929811/unity3d-calculate-remaing-time-for-a-decreasing-value',Unity3d Calculate remaing time for a decreasing value,2,-1,1
'/questions/70929810/whenever-i-try-to-create-an-angular-project-ng-new-i-get-this-error',whenever i try to create an angular project (ng new ......) i get this error,0,0,1
'/questions/70929809/is-there-any-tool-to-migrate-data-from-cassandra-or-any-nosql-db-to-aerospike',Is there any tool to migrate data from Cassandra (or any NoSQL DB) to Aerospike? [closed],0,-2,1
'/questions/70929808/conditionally-wrap-code-inside-view-swiftui',Conditionally wrap code inside view SwiftUI,3,0,1
'/questions/70929807/can-someone-tell-me-how-to-fix-this-error-i-saw-soemone-doing-the-same-thing-and',can someone tell me how to fix this error i saw soemone doing the same thing and it worked for them but not for me please help me,0,0,1
'/questions/70929806/i-tried-to-launch-h264-video-files-with-gstreamer-but-got-the-gray-video-image',I tried to launch h264 video files with gstreamer but got the gray video image,0,0,1
'/questions/70929804/want-to-join-arrays-horizontally-by-condition-numpy',want to join arrays horizontally by condition numpy,2,2,1
'/questions/70929802/how-to-share-azure-spatial-anchors-across-devices-using-swift',How to share azure spatial anchors across devices using swift,0,-1,1
'/questions/70929801/css-not-working-when-uploading-laravel-to-shared-hosting',css not working when uploading laravel to shared hosting,1,-2,1
'/questions/70929799/ngx-build-plusexternals-not-working-for-angular-13',ngx-build-plus:externals not working for Angular 13,0,0,1
'/questions/70930295/angular-creating-nested-menu',Angular creating nested menu,0,-1,1
'/questions/70930293/method-to-combine-multiple-query-resultnode-postgres-in-nodejs-express-js-resp',method to combine multiple query result(node-postgres) in nodejs express.js response.json,0,0,1
'/questions/70930288/send-base64-image-with-correct-headers-in-express',send base64 image with correct headers in express,0,0,1
'/questions/70930281/python-concat-dataframes-where-one-of-them-is-empty',Python: Concat dataframes where one of them is empty,1,0,1
